rose quality ball,53,5,1975-08-22 15:30:40,69,30,bendable and skinny and well-argued and crushable
pink latest camera,230,2,1984-04-08 23:56:28,79,61,erratic and incidental and rewarding and speckled
yellow nice harddrive,277,1,1979-02-16 20:04:58,82,41,younger and metallic and plane and specialist
beige latest projector,261,3,2003-02-13 09:31:33,11,89,forgettable and taxing and hydraulic and amphibian
red good slippers,28,2,1975-04-06 14:02:17,100,64,befuddled and squeezable and ossified and divergent
green best The Sword in the Stone book,208,1,1992-03-13 14:41:12,49,97,secretive and uncontainable and patterned and irritated
indigo latest socks,13,2,1970-03-29 03:07:13,66,98,alterable and orthopedic and polyunsaturated and deliberate
coral cool mousse,52,3,1997-02-28 01:21:38,9,69,gallant and swooping and slight and expressive
beige older retainer,48,1,1996-08-15 17:11:15,45,39,relaxed and full and work-oriented and unbridled
lime quality Peter and Wendy book,217,4,1973-09-14 04:31:28,56,38,unequaled and our and unimpeded and principled
charcoal shiny yogamat,133,4,1979-03-15 10:58:13,54,25,unwieldy and drained and miserable and hazardous
maroon best The Tale of Peter Rabbit book,92,3,1977-08-21 10:55:01,68,22,distinguished and fun and unconstrained and controllable
khaki vintage dumbbell,281,4,2000-12-06 11:19:09,21,75,dulcet and noble and foamy and attributable
rust latest suit,197,1,2015-04-22 02:49:59,18,36,dedicated and obsolete and expectant and imaginative
brown vintage shorts,202,3,2003-04-13 06:44:25,47,34,bodacious and odorous and deprived and impertinent
yellow vintage laptop,287,5,1989-10-28 06:13:19,54,87,pointless and tepid and stuffed and programmable
white vintage camisole,182,2,1983-06-05 08:03:56,27,80,proportionate and chatting and gold and senior
bronze shiny Billy Bunter of Greyfriars School book,201,1,2006-09-09 01:22:32,70,29,palatial and subtitled and deluded and squiggly
teal cool grinder,228,5,1986-12-11 09:45:13,61,100,unrealized and breakable and black and innocent
cream great tablet,81,3,2011-01-18 07:28:54,10,36,atrocious and uncouth and ungentlemanly and prudent
white dull legging,129,5,2017-10-06 22:25:05,4,58,uneven and mean and abrasive and estimated
orange 5star harddrive,221,3,1994-06-22 10:43:09,60,34,trashed and cluttered and tiresome and subversive
beige vintage speaker,113,1,1973-07-24 05:37:27,71,63,masked and barren and inhospitable and sociable
indigo nice shoes,211,4,2002-11-16 12:42:07,98,81,chilling and well-maintained and unrelenting and outward
bronze nice jogger,151,1,2001-11-07 03:33:03,90,52,unobtrusive and moronic and breathtaking and choking
violet good jeans,279,1,1996-09-02 06:28:54,13,68,wizardly and significant and warmest and miserly
charcoal shiny yogamat,102,4,1988-11-11 15:58:27,22,64,implosive and captivating and ultrasonic and unprofitable
rust older Just Jane book,230,1,1980-04-02 12:08:24,59,11,trim and accusing and undependable and vanishing
pink quality ladle,280,1,2018-11-05 17:33:33,91,53,superior and ambitious and joint and crunchy
tan great The House at Pooh Corner book,22,3,1981-03-17 05:17:47,41,72,theatrical and sportsmanly and explosive and thoughtless
pink vintage spatula,283,2,1999-07-09 10:47:21,10,78,valid and scrupulous and appealing and poorest
black latest cord,117,1,2008-06-15 02:13:34,56,92,unknown and greatest and starched and unfortunate
oatmeal 5star mask,115,4,1989-05-28 20:06:13,5,78,choking and awkward and antisocial and overworked
rose great retainer,97,2,1998-08-27 10:29:51,15,90,astronomical and disputable and expansive and reassuring
lime cool desktop,169,5,1994-06-24 01:40:28,17,25,distinguished and breathtaking and truthful and habitable
khaki dull buttonup,142,1,1982-05-27 17:54:45,56,96,shabby and voluntary and indelible and long-winded
rose dull The Railway Children book,258,4,1993-02-04 10:27:19,54,28,vicious and wolfish and fractious and worthwhile
rose dull booties,46,5,1985-06-25 15:17:46,77,98,pithy and unbeatable and displeased and anticorrosive
brick cool retainer,203,3,2019-07-11 12:46:45,98,3,bigoted and undamaged and nutritious and camouflaged
orange shiny The Little Grey Men book,107,1,1977-07-13 20:59:16,63,21,anticorrosive and crawling and unintentional and simian
silver good lithium,42,3,1999-06-25 21:09:43,96,70,powerless and cavalier and savory and clapping
white shiny shelf,59,4,1981-07-25 16:27:57,21,57,unfavorable and ironic and kinesthetic and correct
indigo dull soundbox,185,1,2020-09-16 09:54:30,96,8,mere and theoretical and recessive and sober
violet 5star projector,207,2,2013-08-27 14:40:09,34,82,good and fair and wily and ambulatory
lime nice strainer,289,2,1987-09-12 09:57:41,9,90,that and telepathic and dear and extendable
lilac latest shirt,211,5,1980-11-02 12:39:29,69,86,corner and terminal and terminal and lamentable
silver 5star The Mystery of the Burnt Cottage book,203,4,1996-03-28 07:38:15,54,35,single-minded and pristine and enraged and impressive
silver matte coaster,141,4,2021-12-10 13:34:57,48,38,huffy and conformable and luminescent and incomparable
cream good boombox,289,4,2009-01-13 05:05:01,7,56,extra-large and clashing and irritated and influential
tan great The House at Pooh Corner book,139,2,2003-03-17 03:33:40,18,13,regional and pretentious and scarred and psychological
coral dull Biggles Flies East book,188,3,1985-05-09 02:15:34,49,51,cramped and brainy and astringent and unstated
brick latest mousse,140,2,1980-06-03 11:42:20,59,22,fearful and nasal and cluttered and sparse
rust best boots,181,4,1974-12-07 07:10:41,37,41,cleared and eternal and repugnant and diabolical
indigo older Billy Bunter of Greyfriars School book,83,4,1981-04-05 11:14:37,43,92,economical and occasional and background and doleful
lilac quality camera,277,3,2012-05-08 09:58:03,7,52,unorthodox and proverbial and declining and subject
red 5star camera,137,4,1979-06-11 20:02:22,66,4,illicit and succinct and smoggy and tectonic
orange dull soap,145,4,1989-11-07 09:53:32,66,14,quotable and variable and reactive and fiscal
violet 5star brush,2,4,1992-04-06 14:58:11,25,62,closeable and stumbling and unassailable and unfilled
blush shiny cup,166,5,1997-08-05 11:26:54,61,3,betrayed and aimless and dismal and specialized
violet vintage jegging,65,4,2018-05-03 07:29:56,13,19,unequal and successive and unpleasant and adrenalized
red cool whisk,52,2,1994-03-24 05:27:57,68,97,flammable and quick-drying and coercive and immeasurable
lilac matte case,30,5,1995-08-23 10:39:05,90,1,mountain and courteous and refreshing and optional
black shiny case,3,4,1971-10-08 02:31:26,31,94,fourth and knowledgeable and aimless and relatable
pink nice endpiece,8,3,2015-09-16 13:23:23,81,86,unadorned and dreadful and inaccessible and watertight
lemon good sink,29,3,2017-03-02 06:22:34,67,85,dandy and hypercritical and cropped and unselfish
red vintage cream,1,2,1970-12-16 10:34:04,26,15,immobile and warlike and exchangeable and sweet
pink cool socks,199,3,2010-02-28 01:28:21,73,80,downhearted and roundtable and undeviating and harmful
magenta cool The Story of the Amulet book,86,4,2012-09-02 08:33:41,97,5,sensational and fiendish and delightful and material
teal nice flower,260,4,2021-05-22 06:17:48,2,86,computerized and spiral and middle and emblematic
red quality A Little Princess book,278,5,1980-03-11 10:47:30,28,10,born and lopsided and retrospective and cohesive
tan vintage belt,207,2,2006-12-18 17:08:18,38,12,opulent and mathematical and indulgent and unpersuasive
oatmeal dull router,296,5,2015-08-01 08:44:39,4,92,fainthearted and undesirable and enamored and involved
grey cool harddrive,156,1,2017-01-19 20:25:52,33,14,discussable and shrieking and sterile and irregular
brick nice khakis,90,4,1975-12-23 21:32:48,53,11,foul-smelling and incomprehensible and visual and edgy
oatmeal best The Abbey Series book,285,2,1989-01-24 11:46:06,96,71,filmy and inadvertent and mysterious and transient
lemon best foambloack,290,3,1999-05-06 10:08:54,17,91,thorough and clean and rescued and doubting
grass good Dimsie Goes To School book,131,2,2003-10-07 09:49:40,24,83,well-kempt and undiminished and athletic and unworthy
rust shiny dumbbell,248,4,2013-10-13 10:30:31,86,91,noncommittal and tipsy and timid and conventional
yellow older harddrive,260,5,2014-09-07 06:21:33,97,72,these and ossified and scrawny and uncivil
magenta great jogger,128,2,1990-12-08 18:57:13,44,16,domestic and comical and ecological and fraternal
green cool knife,114,4,2019-05-19 19:39:13,89,49,substantiated and educated and discouraged and inexpressive
lime good barstool,204,4,2009-07-17 10:41:18,16,77,background and stinging and middle and promised
salmon latest camisole,248,2,2001-01-19 14:09:35,26,18,binding and unshakable and succulent and exciting
red shiny mattress,152,1,1994-04-16 20:30:38,65,92,restrained and floral and bruised and illegible
white cool buttonup,262,4,1975-12-15 22:12:06,87,22,limited and sleek and pedestrian and forgettable
brick cool foambloack,171,3,1979-03-12 01:11:48,100,1,useless and fuzzy and ticklish and necessary
tan cool booties,188,1,1985-09-06 03:44:05,76,9,believable and ill-fated and exterior and irreconcilable
oatmeal nice ties,142,4,1975-09-11 01:46:45,30,7,extreme and individual and day and purple
grass dull chair,221,3,2010-10-27 16:13:27,86,60,obese and ambitious and flowery and away
salmon latest cord,234,1,2009-09-02 04:19:11,38,88,stunning and mute and rare and slushy
bronze nice vase,220,1,2010-09-26 08:08:10,69,75,accidental and indomitable and tightfisted and lovely
burgundy cool sieve,162,3,2003-11-24 03:02:19,16,42,tremendous and obese and vigilant and circling
orange shiny desktop,254,2,2010-12-29 10:57:25,89,2,simple and self-effacing and weird and tanned
gold 5star yogamat,40,5,1995-02-04 08:26:51,98,30,sonic and overenthusiastic and maternal and prize
cream latest boots,1,5,2006-05-13 19:31:05,78,61,undeveloped and apprehensive and maternal and rash
coral shiny The Secret Garden book,55,1,2007-05-11 08:52:09,20,98,overemotional and detached and contemplative and topographical
tin nice crewneck,160,2,1989-11-07 01:47:20,87,59,retired and interior and numerable and fiendish
bronze 5star spatula,283,2,1990-06-29 02:02:53,3,35,important and rhetorical and ajar and audacious
black latest mask,183,1,2007-10-17 13:52:31,72,37,revolting and customary and unquestionable and imperfect
coral quality vase,294,5,1997-08-25 12:07:51,5,27,uncharted and prevalent and well-deserved and fearless
bronze nice jogger,21,1,1983-10-16 14:15:30,93,32,noticeable and embittered and well-versed and weakened
brown shiny pomade,224,1,1985-04-17 16:51:36,32,61,dear and peerless and repulsive and incandescent
yellow 5star bowl,123,5,1976-12-22 17:19:47,66,51,hissing and diplomatic and ungracious and opinionated
burgundy best earbuds,102,5,1979-06-29 10:26:14,86,38,constructive and survivable and dilapidated and undiscovered
white latest watch,107,3,2010-11-26 08:10:23,45,58,aggravated and quality and reassured and snotty
blue nice crewneck,205,2,1970-11-01 15:56:52,13,12,amazing and unblushing and cancelled and youthful
magenta cool The Story of the Amulet book,232,1,2017-06-20 12:16:54,19,38,venturous and wood and adjustable and abstracted
white quality trousers,138,2,1998-09-25 10:38:29,62,70,up-to-date and waiting and cozy and proof
burgundy cool sieve,136,1,1985-11-22 06:49:52,95,9,authoritative and visual and well-meaning and tanned
khaki quality lightbulb,39,2,2012-09-14 01:54:32,68,14,callous and unconvinced and satisfied and radioactive
red good jacket,113,5,1982-06-09 23:38:25,53,5,"accusing and humiliated and some, and high-pitched"
indigo 5star lightbulb,4,1,2009-09-08 18:05:56,96,45,challenging and hulking and culpable and foxy
cream good spoon,36,3,1995-03-01 20:34:15,81,82,structural and exquisite and troublesome and hairless
rust latest The Two Towers book,226,5,2021-09-22 04:51:33,9,97,incorruptible and tonal and incomparable and batty
maroon vintage dumbbell,73,5,2009-12-11 07:38:10,17,76,rousing and inexpedient and scary and chic
bronze shiny Billy Bunter of Greyfriars School book,172,4,2016-04-20 08:51:27,41,6,deformed and self-interested and hulking and carpeted
violet matte harddrive,27,2,2012-03-01 23:11:31,48,95,safe and meticulous and salacious and uncreative
magenta dull shirt,252,4,1991-06-19 08:11:07,25,66,cornered and gaunt and semiconscious and alive
maroon vintage dumbbell,111,2,2010-10-13 03:04:13,5,21,hyperirritable and anticlimactic and congenial and last
lemon older mouse,224,1,2021-08-06 16:01:11,17,1,camouflaged and nutty and far-flung and enchanted
orange quality microwave,48,1,2017-09-15 02:18:20,51,43,inexpedient and ungenerous and hateful and phonetic
indigo great bandanas,112,1,1975-07-05 22:17:04,53,89,moronic and rutted and desperate and mental
oatmeal vintage A Little Princess book,104,3,1976-07-19 15:27:35,100,23,unwritten and long-winded and delectable and eligible
gold cool case,49,3,1999-04-05 10:26:13,6,12,impeccable and autobiographic and possessive and spotless
khaki matte rack,1,1,2012-09-09 17:12:09,97,58,pressurized and robust and phonetic and fearsome
pink good pomade,230,3,2009-04-24 16:47:28,81,39,raspy and dire and permeable and wonted
coral good shirt,15,5,2013-07-28 11:10:58,65,16,symptomatic and tacit and tentative and furry
teal dull microwave,11,1,2019-10-16 04:20:34,19,15,untamable and marketable and tireless and deniable
rose older blazer,173,3,1985-06-14 11:08:30,49,10,snuggly and seemly and compassionate and disconnected
red shiny mattress,143,1,1993-12-24 10:49:33,7,79,uninformed and precise and cute and earnest
orange 5star harddrive,205,4,1991-10-13 15:24:58,34,29,solar and sardonic and brainy and remedial
burgundy best microwave,276,2,2009-02-18 11:55:49,76,53,nonrefundable and flaming and inappropriate and adamant
gold great mouse,284,3,2003-09-08 18:35:12,76,62,stumbling and heady and capricious and ingenious
brown matte boombox,289,4,1990-04-04 09:55:37,30,44,peculiar and chatty and dissolving and cagey
khaki good fryer,65,5,2005-10-08 22:47:35,51,30,soggy and compassionate and intermittent and own
tan shiny couch,216,1,2006-01-24 16:23:02,4,31,airsick and less and fixed and acknowledged
blush shiny Five Children and It book,150,3,1984-05-06 14:20:10,31,99,written and disconnected and three and stylish
lilac matte case,119,3,2019-07-18 22:30:12,59,53,content and agrarian and squealing and satiny
teal cool earphones,287,3,2014-03-06 17:33:59,27,98,lovable and graceful and designer and repetitive
gold great mouse,213,5,1984-01-11 12:05:28,92,50,unforgivable and substantiated and good-natured and derogatory
charcoal nice boombox,103,5,2020-03-29 10:34:54,14,43,rectangular and attributable and yelping and rambling
lime latest footrest,77,5,1983-03-25 10:13:17,39,56,pretty and pluralistic and porous and monstrous
orange 5star harddrive,289,1,2008-09-01 07:24:18,21,6,merry and distressed and shady and freezing
brick dull spoon,220,3,1984-12-23 20:44:52,58,14,unattached and lethargic and cantankerous and blood-red
white older Dimsie Moves Up book,287,4,2014-11-19 19:05:13,29,65,secret and unblinking and tenth and transitory
tan best foambloack,169,2,2015-09-24 22:54:40,59,41,bitter and glass and unpredictable and transformative
lilac older phone,282,3,1996-05-28 11:23:12,11,50,smothering and injured and remedial and lucrative
bronze best Brendon Chase book,289,2,1985-06-13 16:21:40,9,17,masked and frustrated and crushed and contemporary
tan nice watch,100,5,1975-03-07 05:21:38,7,73,jazzy and unobtainable and unscrupulous and rank
indigo matte booties,223,1,1987-06-16 09:40:52,100,10,edgy and unassisted and unreasonable and narcissistic
tin quality booties,190,5,2015-09-22 06:28:14,10,98,unsure and exposed and connectable and clumsy
yellow vintage crewneck,231,5,2017-11-08 16:41:36,19,88,ritualistic and duplicitous and a and persuasive
pink great tshirt,242,2,1990-01-19 23:26:56,17,30,pernicious and lighthearted and mindless and reprehensible
salmon latest camisole,41,5,1985-01-09 01:41:40,4,21,mistrusting and quizzical and harsh and showy
rose older dress,188,2,1981-06-23 20:44:34,83,46,unperturbed and obligatory and uncivil and viral
maroon latest Peter and Wendy book,131,2,2002-05-12 04:59:20,45,10,phobic and venomous and built-in and scalding
beige vintage barstool,38,3,1999-03-08 06:58:40,33,92,identical and floppy and unsurprising and prophetic
green dull conditioner,91,5,2011-12-20 18:19:09,95,33,delightful and inspired and celebrated and unfaltering
blue cool Meredith and Co. book,294,1,1972-08-05 10:16:35,59,16,embattled and sealed and infantile and advisable
yellow quality couch,109,2,2013-11-06 10:46:32,65,1,nonspecific and illiterate and rebel and twinkly
khaki 5star The Railway Children book,7,1,1977-06-03 09:55:17,75,15,tempted and well-qualified and judicious and rapid
grass matte buttondown,16,1,1999-02-04 23:13:48,45,81,coercive and squatting and verifiable and nonabrasive
black older jorts,133,3,1990-05-14 06:09:49,22,21,vanishing and local and saucy and operational
maroon nice case,220,4,1991-09-14 19:33:17,96,34,spicy and contractual and injudicious and phonemic
teal best jorts,35,2,1991-12-03 15:59:20,94,73,formulaic and all-around and unfaithful and infuriated
pink dull strainer,223,1,1976-11-24 06:09:06,50,76,unmanly and low and irritable and detachable
grass latest soundstation,127,1,1985-07-11 11:28:40,10,11,hard and unconstructive and filmy and receding
charcoal cool shorts,197,4,1980-05-15 07:52:20,15,28,prim and well-honed and purified and exploited
lemon shiny gadget,298,1,2012-02-25 18:41:53,42,44,warring and fitting and modern and wordy
burgundy best jogger,95,1,2009-06-19 20:27:06,66,54,incorrect and standoffish and beneficial and neurological
tan good ties,163,2,1985-11-15 23:29:09,47,69,disparaging and litigious and embroiled and common
brown good keyboard,193,5,1974-03-29 23:15:38,92,91,crucial and snobbish and cordial and sensational
cream best The Secret Garden book,55,1,1982-09-16 22:42:14,4,8,clumsy and petite and frightful and suave
oatmeal nice foambloack,59,1,2013-06-27 13:53:14,50,90,probable and ubiquitous and educated and cultural
tin nice The Candle in the Wind book,54,1,1998-05-20 23:16:39,60,5,expert and unstated and furthest and good-looking
blush 5star dish,192,4,1993-10-15 05:22:23,83,17,flavored and kindhearted and shabbiest and conditional
charcoal nice hairspray,266,2,1973-05-11 18:25:08,79,32,purring and classical and ticking and alone
rust latest The Two Towers book,83,1,1988-01-07 15:59:07,78,8,disciplined and equable and sober and doting
lime dull cup,16,1,1982-11-09 08:45:03,42,74,arduous and hypnotic and drunk and encouraged
white dull slippers,146,5,2010-09-10 05:53:08,55,37,unspoiled and gangly and taboo and inescapable
gold shiny The Candle in the Wind book,199,4,1971-07-20 03:59:01,89,100,accused and spotless and low and national
lemon matte hulahoop,95,3,1985-08-16 12:14:35,90,19,abrasive and negative and sore and acclaimed
khaki 5star flosser,266,4,2017-10-20 18:37:25,41,38,gruff and damp and inhabitable and villainous
grass nice The Tale of Peter Rabbit book,217,4,2006-12-13 15:27:53,39,31,rascally and ripe and unmerciful and paradoxical
blush cool volumizer,275,5,1987-07-02 06:29:39,29,94,close and mangy and eroding and relative
tan great soap,221,4,2014-11-17 08:47:58,19,47,undisciplined and displeased and weird and softhearted
blush latest coffee,50,4,1973-12-15 19:19:51,76,45,dandy and disobedient and disappointing and odorless
violet great dress,129,2,1995-04-25 03:58:09,6,2,reactive and computer and unmasked and bodacious
maroon good table,274,4,2006-02-03 15:13:57,69,27,bland and serene and upright and unenthusiastic
grass cool Billy Bunter of Greyfriars School book,185,3,2010-01-17 08:08:09,71,27,curt and malicious and floral and executable
white 5star moisturizer,61,3,1972-09-22 04:28:24,85,78,hectic and lulling and up-to-date and caustic
brown shiny mask,230,5,1999-06-15 14:08:52,80,95,ethereal and telegraphic and sickened and praiseworthy
charcoal vintage microwave,170,2,1990-03-19 05:39:59,95,20,gray and unverified and unexplainable and unendurable
grey cool harddrive,38,4,2000-01-02 01:35:02,68,8,astronomical and subject and venturesome and smoky
pink cool hulahoop,277,1,2000-02-05 23:13:13,24,79,perceivable and more and well-used and attributable
black matte bedframe,40,1,1988-06-10 14:29:19,16,80,underprivileged and beefy and burning and mean-spirited
grey cool tablet,237,1,2021-07-02 16:19:34,32,38,like-minded and political and specific and stuttering
green dull foamroller,137,4,1974-10-05 03:27:38,78,25,social and congenial and reverential and languishing
purple cool mouse,91,3,2002-01-24 19:37:40,70,36,barbaric and united and overwhelmed and finicky
violet vintage sink,151,4,2013-07-01 09:27:27,33,90,iconoclastic and resident and hyperirritable and eruptive
yellow 5star pants,90,1,1976-11-25 07:02:17,62,7,candid and inquiring and commemorative and fictional
orange latest sweatshirts,288,5,2010-09-14 21:28:05,8,65,befuddled and pithy and somatic and divided
tan great mousepad,193,5,1976-04-26 05:13:20,70,91,unthinking and larger and unappreciative and parched
salmon quality cream,154,3,2020-10-28 22:11:29,43,18,accommodating and disarming and careless and nebulous
brown latest speaker,122,3,2007-08-23 02:37:16,26,45,minimum and tenacious and sloping and tardy
burgundy 5star desk,229,4,1996-03-08 20:49:45,18,61,perplexed and cheery and short-lived and adrenalized
lime good vitamin,178,4,1975-03-25 05:38:43,75,39,tactual and duplicitous and untamable and infatuated
green latest phone,166,2,2013-04-19 21:46:54,12,9,verdant and monumental and jerky and engaging
brick latest mousse,211,3,2000-11-08 02:20:26,53,38,cautious and convoluted and inoperative and princely
teal dull jacket,172,1,2009-11-27 13:52:16,84,36,instrumental and inalterable and petulant and gratis
oatmeal good Dimsie Moves Up book,249,2,1996-03-12 14:31:53,83,61,inattentive and reassuring and digital and faltering
brown quality barstool,248,1,1970-07-18 02:28:44,75,67,fertile and liberal and wild and preemptive
pink latest Winnie-the-Pooh book,248,1,1984-06-26 13:27:11,5,71,impish and federal and obtrusive and flickering
violet latest supplement,66,2,1997-06-20 02:30:09,97,1,mortal and his and drivable and corpulent
rust nice shorts,120,5,1981-11-19 10:12:57,42,76,crossed and solar and glowing and infatuated
bronze vintage Swallows and Amazons series book,294,3,2017-05-25 16:19:09,46,98,abounding and worthy and middle and pluralistic
burgundy matte cream,48,4,1975-06-14 21:51:24,81,14,manageable and stagnant and legitimate and saccharin
lemon great The Lost Prince book,192,1,1979-10-11 03:55:45,93,58,fatal and programmable and crisp and uniform
charcoal shiny soap,83,3,1970-08-11 04:27:32,49,5,seven and spectacular and sober and unemotional
white cool buttonup,291,5,1978-09-23 13:56:31,16,1,bloated and rumbling and discouraging and trashed
bronze older Meredith and Co. book,274,5,2008-01-08 14:48:15,81,8,conflicting and parasitic and unfortunate and teensy
salmon shiny The Tale of Mrs. Tiggy-Winkle book,75,2,2012-07-25 02:38:02,85,4,cooing and intolerant and weightless and seventh
lilac nice Peter and Wendy book,255,3,1973-03-20 12:07:13,41,63,medical and distressed and fussy and relative
rust latest suit,228,1,1970-06-03 03:41:20,45,92,wee and durable and bashful and plastic
khaki good The Queen of Air and Darkness book,87,5,2010-01-16 03:29:58,62,25,sparkly and escalating and smashing and infallible
charcoal older blazer,38,4,1997-09-02 20:46:29,11,5,grimacing and pricey and provocative and ageless
blush vintage dumbbell,28,1,1974-03-21 09:16:18,89,41,resealable and disgruntled and torrid and humid
tin shiny pill,254,5,2017-08-17 20:12:21,56,59,"crumply and some, and giant and astringent"
black great moisturizer,292,5,1997-01-01 07:54:06,42,74,pleading and rich and moaning and crispy
silver 5star The Mystery of the Burnt Cottage book,82,2,2020-09-29 15:40:25,14,23,valorous and uneventful and vivid and treasonous
teal dull microwave,269,4,2003-12-08 17:45:22,27,26,sweeping and dignified and damaged and infantile
grass cool shampoo,208,1,2001-05-16 03:54:59,90,30,entranced and closeable and brutish and consoling
orange cool slippers,78,5,1984-09-21 05:19:05,6,19,elastic and laughing and congruent and listless
grass vintage Biggles Flies East book,278,4,1986-10-26 07:32:04,47,70,unbearable and psychiatric and judgmental and saddened
khaki cool lithium,268,1,1995-11-13 19:26:21,42,93,cognitive and expedient and easy and peremptory
white quality knife,86,1,1982-07-02 10:47:26,42,71,lawless and extraneous and financial and rippling
black shiny conditioner,250,1,2006-09-17 05:09:57,25,81,which and rank and colorless and scenic
oatmeal quality The Ill-Made Knight book,97,5,1979-12-05 21:13:11,8,30,unverified and transitional and relentless and irrelevant
violet older ties,278,2,1988-01-27 21:07:38,58,71,disliked and thin and humorous and sassy
pink vintage glass,201,3,1972-03-25 20:39:39,36,70,poetic and treasonable and amazing and incandescent
lilac 5star computer,208,2,1979-09-26 11:01:09,9,77,talkative and narrow-minded and outspoken and day
orange matte sweater,203,3,2002-06-04 18:14:44,9,37,tactical and studious and muffled and shallow
tin matte television,228,1,1981-10-03 11:59:52,75,40,trendy and shortsighted and long-term and ridiculous
maroon vintage shampoo,88,5,2020-09-23 16:12:27,69,17,desirous and diabolical and alarmed and thoughtful
salmon latest The Secret Garden book,62,3,1972-08-28 20:58:39,17,3,disjointed and deceivable and faithful and displaced
beige older television,230,4,1979-03-25 04:55:17,19,66,snuggly and commanding and slothful and late
