bronze nice vase,129,1,1977-06-17 09:07:36,42,18,thematic and hydraulic and unraveled and unpardonable
rose cool The Secret Garden book,7,4,1984-04-03 23:02:29,32,73,stoic and unsubstantiated and perilous and wriggling
bronze latest A Popular Schoolgirl book,121,5,1998-11-22 06:50:28,56,30,low and rainy and splattered and ruinous
teal dull microwave,259,2,2009-06-19 08:29:40,95,91,spotted and weary and minor and excusable
burgundy matte brita,21,3,2013-01-03 11:55:48,10,36,startling and yummy and rapturous and semiofficial
burgundy best Old Peter's Russian Tales book,291,4,2008-10-07 13:15:27,92,53,slanted and dapper and smelly and silver-tongued
black shiny case,32,1,1971-10-17 11:13:47,88,53,watchful and automatic and timely and misty
silver cool router,261,1,1994-12-02 18:30:05,65,18,splintered and foolhardy and big-city and dutiful
white great speaker,79,4,2009-05-21 18:12:56,99,91,irrevocable and codified and bewitched and vagrant
pink great tshirt,171,5,1977-07-20 17:09:48,47,71,venturous and overemotional and flabby and stony
charcoal matte Just William book,256,2,1981-08-10 15:30:46,2,79,recognized and fireproof and pure and less
lime matte chair,96,4,1978-05-28 02:22:03,15,91,scalding and euphoric and telegraphic and teenage
brick 5star The Tale of Peter Rabbit book,20,1,1995-12-07 14:27:27,41,9,reactive and chemical and well-equipped and dazed
beige latest projector,130,2,2021-03-27 23:52:05,73,34,wounding and essential and small-scale and rancid
blue cool vase,92,4,2002-11-03 12:17:53,67,56,beefy and putrid and stark and dirty
lime nice keyboard,165,2,2007-09-05 09:27:03,19,48,liberal and merciless and adhesive and antiquated
teal cool grinder,196,5,1975-06-17 13:38:45,11,66,darkened and bloodied and near and pronounced
magenta dull mousse,261,2,1979-08-19 08:19:05,79,11,vegetative and desirable and pointless and grizzled
blue great plate,59,5,1977-04-20 16:37:48,70,11,refreshing and oppressive and splintered and thirsty
purple older soap,262,2,1983-04-05 03:51:33,76,98,endless and quick-witted and prolific and prejudiced
green cool laptop,112,4,1983-07-22 17:24:38,79,45,sustainable and despairing and high-functioning and curious
beige good jacket,146,2,2005-01-13 22:21:06,73,86,inexcusable and razor-edged and punishable and blistering
blue great The Little Lost Hen book,118,1,1975-09-16 13:08:11,81,83,calculable and hour-long and disaffected and unappreciative
orange best shirt,110,5,2015-10-16 09:01:59,81,2,adaptive and short-lived and alien and impossible
black matte bedframe,294,3,1996-11-19 21:37:20,23,88,dazed and degraded and fretful and furthest
gold latest rack,258,5,2001-01-11 03:31:10,57,2,indisputable and queenly and subservient and completed
indigo best The Secret Garden book,231,5,2012-11-10 05:57:03,39,97,tidy and affirmative and opportunistic and torturous
teal great retainer,97,4,2020-09-05 14:59:03,52,76,dapper and tight and valorous and saintly
lime nice strainer,291,3,1978-11-09 21:39:54,70,50,tuneless and sustainable and troublesome and acoustic
blush quality moisturizer,246,3,1970-02-06 01:06:21,33,15,unforeseeable and corrective and animated and laughing
tin 5star earphones,130,3,2009-01-01 19:33:41,13,56,her and computer and perishable and extension
tin 5star mousse,211,3,1975-06-23 22:27:51,47,77,congenial and satiny and industrial and driven
purple shiny endpiece,180,4,1979-01-25 21:21:33,62,39,unrestrained and tanned and exaggerated and well-thought-of
salmon dull A Little Princess book,118,5,2020-06-15 05:29:34,23,36,unwitting and initial and torpid and accountable
white shiny shelf,201,4,1989-08-21 08:01:24,41,54,fun and deliberate and aquatic and accusative
red dull The Tailor of Gloucester book,231,1,2013-06-05 07:34:56,58,66,huggable and thankful and two and abandoned
rose great sieve,45,1,1991-04-02 21:55:50,19,19,dressy and irrational and generous and dishonest
teal quality case,287,1,1986-08-05 13:45:35,99,38,magnificent and soldierly and repentant and untrustworthy
khaki 5star flosser,151,4,2021-01-14 21:33:10,66,49,proverbial and entire and unfair and old-fashioned
lime nice keyboard,260,2,2021-05-17 01:38:52,66,84,convincing and spontaneous and colorless and highest
gold great mouse,190,2,1985-03-29 07:57:36,63,81,unquenchable and tiring and filtered and finite
pink vintage harddrive,145,2,2001-10-10 03:35:49,50,25,fundamental and jeering and executable and standoffish
green dull foamroller,119,4,2020-11-12 04:27:35,16,67,unquenchable and tricky and correct and satiric
teal quality endpiece,141,3,1979-01-02 12:29:13,26,95,scalding and adequate and immodest and sick
white older The Ill-Made Knight book,147,2,2000-11-12 09:03:22,98,86,game and spare and uncluttered and nasty
indigo older Billy Bunter of Greyfriars School book,287,4,1998-11-01 10:55:01,65,34,wooden and tapered and training and abhorrent
yellow good phone,268,5,2015-02-14 23:29:29,83,8,exposed and hypothetical and unsound and ignorable
pink vintage spatula,270,2,1979-11-24 18:46:18,24,60,undaunted and legislative and proximate and far
khaki matte rack,181,5,2015-10-10 12:15:17,72,42,brassy and awake and prenatal and unfettered
tan great soap,297,4,2012-07-06 06:55:52,76,5,mythical and bawling and simpleminded and grumpy
black latest mask,39,2,1984-09-18 11:20:35,15,61,marbled and mission and disgraceful and authoritarian
teal shiny brita,186,1,2006-09-21 15:53:58,34,33,nutritional and derogatory and coherent and shiny
maroon matte cord,23,2,1972-05-24 21:57:31,10,42,knowledgeable and ultrasensitive and unredeemable and ultimate
beige older retainer,86,2,1970-12-25 21:12:58,75,76,nasty and passive and revisable and verbal
khaki shiny phone,3,2,1995-03-06 03:34:46,16,97,revealing and sparkly and cheeky and western
gold good supplement,31,3,2011-11-19 02:56:01,93,59,alleged and mission and lifelong and bouncy
khaki cool lithium,165,5,2001-02-05 06:54:03,67,37,moaning and intestinal and piercing and ultimate
maroon cool stool,83,1,1989-10-15 18:15:31,79,33,immaculate and systematic and tough and statuesque
oatmeal great soap,293,3,1998-07-15 12:48:42,42,37,trusting and fair and violet and visual
silver matte sweatshirts,244,1,2002-06-14 12:34:58,83,100,transformative and wolfish and supple and delighted
lime vintage microwave,196,1,2018-10-25 06:42:26,93,70,slick and republican and mistrustful and exchangeable
salmon vintage faucet,170,5,2002-04-23 15:10:09,80,67,reflective and incredible and showy and visible
indigo cool shelf,277,3,2001-06-14 17:51:20,50,91,temperamental and squashy and raving and mobile
rose cool A Popular Schoolgirl book,28,1,2011-04-04 12:20:07,51,20,bizarre and laughable and blaring and disproportionate
bronze nice vase,267,1,1992-07-13 03:21:54,40,33,fretful and unwary and transplanted and limitless
beige quality projector,194,5,2004-03-09 05:27:38,76,35,understanding and snow-white and gregarious and oblivious
tan nice watch,158,3,2012-07-12 15:38:38,1,18,horizontal and operable and usable and endurable
orange nice microwave,259,4,1980-12-22 22:48:49,23,62,fixed and overassertive and stressful and sunny
tin older vase,92,2,1978-03-05 16:15:46,70,85,sharpened and wide-ranging and wintery and nondestructive
salmon vintage The Once and Future King book,194,3,2002-08-15 15:32:54,38,67,murky and rebel and symbolic and startled
lilac quality A Popular Schoolgirl book,28,2,1992-01-06 12:23:35,44,5,euphoric and inequitable and mellow and dependable
yellow 5star bowl,237,4,2020-08-28 13:17:27,69,54,robust and juicy and crying and unworkable
salmon vintage watch,292,4,1989-01-26 01:21:57,53,24,hypersensitive and freckled and unsympathetic and unforgettable
yellow best Swallows and Amazons book,13,5,1976-11-23 07:28:26,52,2,effortless and odorous and resolute and nonspecific
rose older retainer,297,3,2004-12-12 11:48:08,1,78,flat and well-liked and smoked and ill-equipped
white older projector,164,4,1996-09-19 07:59:31,70,58,receptive and capricious and slothful and unhurried
violet latest sweatshirts,44,4,2018-06-23 02:09:34,47,25,unafraid and unsympathetic and bulky and absent
orange nice jeans,84,4,1977-12-24 09:04:42,68,86,worn and ragged and caring and spicy
purple 5star Meredith and Co. book,167,5,1985-03-26 07:33:57,69,44,confirmed and saucy and lingering and built-in
blush shiny barstool,83,2,1997-02-13 16:39:23,5,90,massive and inexpensive and psychosomatic and overprotective
brown quality table,181,4,2005-08-28 05:53:35,60,10,well-developed and creaky and dark and zesty
rose older earbuds,141,2,1982-02-23 01:44:49,68,77,hotheaded and decrepit and mammoth and plopping
indigo cool The Once and Future King book,88,4,1998-03-05 06:17:35,75,37,adoptive and ready and faded and laudable
white latest microwave,177,3,2012-09-25 10:49:01,46,15,condescending and cloistered and unacknowledged and spectacular
teal quality endpiece,299,2,2001-07-11 17:44:29,90,87,attractive and second and interchangeable and sloped
white latest watch,216,3,1988-12-05 16:38:03,87,89,reassured and respective and mincing and nonsensical
cream dull slacks,68,4,2005-03-09 10:34:56,3,53,colonial and unfeeling and adopted and desirous
green older brita,276,4,2020-03-03 22:43:20,82,25,manic and virulent and provoking and inarticulate
rust nice protector,252,5,1988-02-28 13:10:23,47,11,syntactic and verified and fraudulent and blazing
magenta 5star crewneck,16,1,2013-06-19 16:12:14,31,72,lawless and substantiated and sacrificial and interesting
charcoal latest flosser,12,2,1993-12-21 01:35:14,23,74,patterned and well-established and vital and invigorating
burgundy best jogger,133,5,1970-11-04 12:44:12,65,36,outgoing and intrinsic and moral and nonchalant
green best boots,75,4,2004-06-27 12:23:01,49,45,fireproof and infected and sparkly and impermeable
grey great dongle,42,5,1989-04-18 17:48:39,60,54,sheltered and taunting and caustic and rancorous
bronze 5star candle,24,2,1997-03-20 09:19:15,42,31,implicit and dissatisfied and skeptical and unopposed
white latest watch,8,2,1995-09-29 11:45:27,98,62,authoritarian and proximate and repetitive and viable
salmon great The Mystery of the Burnt Cottage book,35,5,1975-08-10 11:04:11,63,28,capable and steaming and sloppy and well-mannered
rose nice toaster,297,5,2020-10-02 04:41:16,68,81,macabre and total and meat-eating and cumulative
charcoal vintage chair,188,2,2002-07-17 09:48:59,72,26,spectral and usual and destroyed and disappearing
tin cool Peter Pan in Kensington Gardens book,116,1,2011-08-23 03:56:40,52,50,one-hour and neglected and adult and pluralistic
rose nice soap,27,3,1999-02-03 09:24:51,47,92,irreconcilable and opinionated and taxing and due
orange great tanktop,237,5,1983-03-12 09:41:30,2,21,treacherous and compulsive and seismic and inhumane
grass 5star Swallows and Amazons book,236,1,1992-12-17 03:28:31,51,31,discontented and indifferent and enforceable and inexcusable
teal good laptop,131,2,2009-12-18 19:07:33,42,69,curt and unclassified and scientific and berserk
silver great legging,197,1,1986-12-14 13:18:46,76,78,cramped and purple and compound and billowy
rose best mouse,95,2,2020-09-26 10:50:21,58,80,sorrowful and unrecognizable and subservient and skillful
green shiny shirt,21,3,2013-08-12 12:22:39,88,96,locked and changeable and erroneous and unfocused
orange cool pill,291,2,1997-02-11 17:45:45,98,9,furious and broken and uncooperative and lengthy
cream nice crewneck,120,3,1970-01-25 14:55:43,76,68,ultrasensitive and morbid and midweek and codified
tan cool trousers,244,3,2000-07-14 03:05:27,33,79,incomprehensible and acid and tearing and trim
grey older flosser,44,1,2007-10-11 14:57:52,27,31,crystallized and perennial and neglectful and pardonable
grass latest brita,132,1,1999-09-26 06:27:47,7,45,maintainable and stinging and magical and worthless
black vintage The Little Grey Men book,278,4,2008-08-27 17:45:05,67,61,affectionate and soaring and evenhanded and proximate
pink quality The Fellowship of the Ring book,185,1,1986-02-01 03:09:06,78,97,patriotic and worldly and big and feminine
lime vintage trousers,220,4,1990-04-11 14:49:30,28,89,noisy and operative and jovial and inoperable
charcoal cool The Story of Doctor Dolittle book,156,5,2007-08-15 14:27:38,31,84,clingy and faithful and enticing and incongruous
magenta vintage raincoat,56,5,1991-06-10 14:53:41,13,26,stupendous and socialist and unverified and disgraceful
maroon cool stool,159,4,1974-04-14 20:40:21,76,25,undependable and red-blooded and challenging and battered
khaki cool kettlebell,65,3,1989-09-25 21:10:42,86,5,discriminatory and commercial and torpid and flexible
rose cool cable,0,2,1977-08-25 22:04:11,100,88,unmanned and tenuous and unexcited and uninterrupted
tan shiny protector,120,4,2019-11-27 13:04:26,68,32,pardonable and fitted and unexpected and exclusive
lemon good Five on a Treasure Island book,289,4,1978-10-03 05:03:32,18,77,scarred and sensational and hated and shapely
rust good The Camels Are Coming book,214,4,1980-05-08 08:59:19,97,48,latter and indestructible and bloody and desirable
rose good The Tailor of Gloucester book,105,3,1970-10-27 05:12:15,31,6,tactual and nonconsecutive and unrealistic and scrappy
lemon latest coaster,100,4,1994-07-02 23:46:58,72,87,noncompetitive and adoptive and sensational and midweek
rose dull foambloack,43,1,1982-03-29 10:42:35,52,34,eccentric and skinny and creeping and chubby
lilac latest phone,49,4,1973-08-26 16:22:06,24,46,indeterminate and tangled and divergent and spiritual
grass good The Sword in the Stone book,14,3,2021-06-04 02:37:25,75,4,brash and utopian and crude and effusive
gold shiny phone,89,2,1988-06-08 13:27:38,3,33,linguistic and banging and handsome and unconvincing
purple nice mattress,196,1,1981-09-11 03:36:48,56,33,cloistered and restful and unrepresentative and humongous
pink best tablet,204,3,2019-03-12 09:57:53,59,81,fragrant and incoherent and beefy and unapproachable
silver best pomade,150,5,1998-04-05 10:23:53,56,45,gabby and unhesitating and classical and inapt
violet latest sweatshirts,187,1,1979-11-26 11:57:58,1,42,revamped and decaying and boring and legal
pink vintage jeans,95,1,1974-01-03 13:53:43,35,97,catchable and northerly and busy and bloody
brick latest sweatshirts,153,1,2010-06-27 12:45:28,76,91,lasting and admirable and every and refundable
blue best desk,204,2,2019-04-29 16:55:55,41,76,loquacious and busy and bureaucratic and falsified
white shiny supplement,192,5,1990-11-14 01:26:20,79,95,sole and educated and craven and safe
red cool cable,105,1,1970-04-05 06:53:49,8,42,watertight and that and geometric and noncommittal
magenta cool The Camels Are Coming book,258,5,1994-01-29 08:52:57,98,42,homely and confusing and philosophical and subjective
blue shiny mousse,50,1,1993-11-13 10:15:46,55,78,caustic and unanticipated and standoffish and cynical
teal shiny headset,101,5,2008-02-09 14:59:35,29,4,spongy and poorest and distracted and massive
coral 5star The Candle in the Wind book,283,2,1998-03-15 12:38:08,97,18,platonic and scrumptious and artless and tall
orange 5star harddrive,65,1,2010-06-21 18:35:55,72,86,cancerous and conspiratorial and rightful and carpeted
rust older Just Jane book,189,2,2010-06-05 22:51:50,73,15,devastating and qualified and undiscovered and complimentary
cream shiny pill,17,2,1972-01-14 17:10:52,60,30,scholarly and notorious and live and inclusive
oatmeal older The Tale of Mrs. Tiggy-Winkle book,157,5,2016-02-08 03:06:12,68,57,forgiving and mutual and logarithmic and polite
black shiny cord,253,1,1989-02-08 14:49:07,25,78,reported and impoverished and disapproving and fit
lime quality computer,184,5,2001-10-02 06:02:39,9,16,prehistoric and sociological and numerous and medicinal
purple cool The Tale of Peter Rabbit book,160,4,2006-10-22 21:40:26,45,16,languishing and spotty and operable and knowledgeable
violet best countertop,92,2,2009-02-06 21:55:21,10,1,truculent and well-honed and misty and receptive
lemon latest coaster,132,4,1979-02-10 05:44:27,32,97,platonic and contextual and spherical and fanatical
blue best desk,246,3,2013-04-14 12:31:01,89,94,feeble and aromatic and crippling and astonished
salmon 5star desktop,109,4,1986-07-24 08:05:46,90,84,evening and mad and cryptic and right-handed
brown matte boombox,299,1,1995-08-22 21:50:24,9,43,scattered and evocative and officious and ghoulish
indigo cool shelf,42,2,1980-06-06 03:48:43,29,34,guaranteed and possessive and several and electrifying
beige good jacket,60,3,2006-05-06 03:01:44,89,26,connectable and folded and insatiable and physical
violet dull protector,55,5,2001-02-14 10:11:46,89,36,flavorful and impractical and ready and insistent
violet best protector,37,4,1996-03-28 19:12:50,74,49,unpalatable and faithless and sky-blue and incompetent
white dull jeans,272,5,1989-04-21 18:41:03,13,35,shy and irregular and nonproductive and otherwise
grass 5star tshirt,72,4,2016-03-02 14:19:04,33,2,moral and unwilling and refreshing and sullen
violet great bookshelf,123,5,2018-11-14 23:06:16,59,14,sunny and feckless and sympathetic and hormonal
charcoal cool conditioner,43,3,2005-02-03 03:38:43,46,65,underhanded and querulous and fifth and hormonal
coral quality vase,174,5,2021-10-21 10:54:59,82,97,humid and teenage and rustic and tranquil
beige matte hoody,293,1,1979-04-03 10:14:25,16,57,involved and spiraled and airline and skillful
blush shiny earbuds,66,4,1971-11-14 22:42:07,50,81,chattering and richest and unadvised and delicate
red quality A Little Princess book,73,4,2016-03-08 05:28:01,36,45,unimpressive and satiny and overactive and upright
lime good barstool,274,3,2009-07-24 16:04:13,67,18,incoherent and opportune and harmonious and national
tin older legging,175,5,2005-03-07 18:30:19,20,92,yellow and sandy and unraveled and remedial
pink vintage tshirt,33,2,2012-08-14 04:55:47,23,56,neurotic and well-lit and prissy and chewable
pink best tablet,82,1,1979-05-23 16:42:29,61,4,down-and-out and official and reverse and deadly
rose good cork,1,5,1976-08-27 21:12:08,87,99,boorish and shy and soulless and numerable
cream dull slacks,117,1,2009-01-06 15:16:22,24,32,bronchial and concurrent and ninth and aimless
salmon best The Railway Children book,237,1,2020-12-25 02:20:56,97,40,conscientious and unknowing and exasperating and plane
yellow nice A Little Princess book,191,2,1973-06-13 09:48:09,88,7,unique and navy-blue and unlivable and perceptual
rose great bandanas,55,4,1974-12-17 01:29:37,24,5,sulky and unstated and amused and decreasing
grey cool booties,86,3,1997-04-25 11:17:20,23,29,presumptive and merciless and expanding and resourceful
maroon good trousers,100,2,2014-08-20 18:58:36,21,86,unreceptive and overwhelmed and nonnegotiable and degraded
bronze older endpiece,250,1,1997-08-17 08:46:03,91,81,still and unjust and reflective and angered
blue matte protector,172,2,2005-11-09 18:03:43,16,34,unfulfilled and inoffensive and much and quantitative
red shiny footrest,104,4,1970-10-14 14:25:33,17,99,heartless and fair and crystalline and hawkish
blue older soap,82,3,1998-11-11 06:10:27,35,3,reasonable and well-liked and sparkly and electric
brown quality table,32,2,2014-04-11 21:08:35,32,33,obedient and third and unambiguous and syntactic
lime matte jogger,7,1,2011-03-04 10:26:02,49,86,peaceful and fanatical and retrospective and blamable
rust cool dongle,27,2,1991-11-16 10:21:45,35,25,plus and ruthless and hard-to-find and controversial
white quality knife,212,5,1974-02-04 02:10:24,7,95,unanswerable and unopened and frivolous and local
purple 5star dress,269,3,1980-02-11 02:01:14,22,10,spiteful and comforting and indispensable and neutral
brown 5star The Fellowship of the Ring book,93,4,1977-04-29 21:20:45,8,76,wrinkly and disillusioned and stifled and huggable
brown dull harddrive,189,2,2001-09-24 03:05:21,10,86,curvy and unaccountable and wordy and unsustainable
grass best soap,143,1,1994-09-28 21:08:14,38,76,barefooted and new and revolutionary and glaring
khaki cool kettlebell,79,2,2020-12-28 22:01:20,91,8,assured and dependable and testy and continual
gold nice pill,195,4,1973-12-26 08:43:19,99,7,lackadaisical and secured and affirmative and preemptive
blue great plate,279,2,2004-02-09 11:53:55,24,88,well-traveled and academic and sociable and fictitious
red latest spatula,163,3,1974-11-29 19:08:56,78,25,mobile and appropriate and libelous and constitutional
beige nice belt,283,3,2020-11-28 06:25:45,7,56,moody and own and verifiable and criminal
bronze 5star pill,237,5,1996-12-16 01:44:35,41,31,unworkable and habitable and unabashed and obvious
violet best toothbrush,287,5,1996-05-18 05:58:34,34,89,faulty and exaggerated and heroic and mercurial
beige nice belt,244,3,1987-04-10 01:44:05,38,53,monotonous and lame and impoverished and creative
blue nice boombox,163,3,2012-07-08 05:02:55,10,36,cryptic and conceivable and unwashed and unattainable
charcoal nice boombox,230,3,2011-04-15 22:58:10,13,69,spotted and usual and thorough and unwary
cream quality Swallowdale book,148,5,2004-04-03 02:34:02,15,80,sociological and motivated and uncomplaining and incomparable
coral latest painting,242,2,1982-09-06 22:55:28,24,67,impish and surgical and certain and snappish
rust dull The Phoenix and the Carpet book,116,3,1998-10-19 20:40:03,23,21,sparkling and touchy and man-made and genuine
maroon nice earbuds,149,4,2010-10-29 12:38:26,64,91,recent and unwritten and same and regular
rust shiny A Popular Schoolgirl book,224,4,1989-03-14 14:43:35,90,89,an and unmodified and mini and presumptuous
brick 5star The Tale of Peter Rabbit book,240,3,2005-06-21 08:58:01,56,7,trusting and bitter and hysterical and factitious
cream quality watch,292,4,1983-10-10 06:39:18,33,48,recognized and promised and displaced and supersensitive
yellow shiny protector,223,3,2017-02-07 22:43:54,76,66,wax and symbolic and self-absorbed and prissy
tan 5star mask,240,4,2014-11-24 03:49:08,61,87,infallible and errant and terse and simultaneous
rust 5star desk,252,4,2006-05-04 17:10:22,48,28,infatuated and unsuspecting and shining and festive
blush shiny hulahoop,222,2,1993-05-25 13:56:53,5,1,ponderous and metabolic and nefarious and nauseating
brown matte peeler,274,4,1993-05-12 09:29:55,83,15,aristocratic and planned and heartbreaking and tenable
blue good lithium,13,5,2005-02-01 12:41:09,29,85,unforgivable and rigorous and mutual and prominent
grass best rack,224,4,1989-10-20 02:56:19,5,62,flawless and distressed and beefy and cracked
khaki dull bedframe,114,1,1977-12-24 01:18:15,73,90,amused and spicy and bellowing and splashing
red 5star camera,170,4,2012-11-01 08:51:58,34,35,soaked and tangled and indifferent and tiny
yellow matte rug,171,2,1986-01-24 07:23:11,9,11,contrarian and prying and saddened and lasting
tin nice hairspray,195,1,2012-02-11 20:13:18,76,10,temperamental and west and additional and tasty
tan shiny booties,263,4,2003-08-29 19:40:40,18,49,showy and afraid and howling and swaying
grey cool longsleeveshirt,152,1,2006-05-26 18:40:07,3,46,punishable and squealing and joyless and effective
khaki older lighter,6,2,1973-01-08 23:21:24,53,44,queenly and buzzing and relative and coldhearted
burgundy dull toothbrush,76,2,1995-09-10 02:01:20,89,8,vulnerable and grand and unruly and exemplary
salmon latest The Secret Garden book,54,4,2001-02-10 14:17:14,35,79,groaning and oxymoronic and pleasurable and bouncy
tan shiny The Tale of Mrs. Tiggy-Winkle book,140,5,1979-02-08 14:17:01,78,26,dirty and unheated and sappy and irritating
lemon great The Lost Prince book,68,1,1987-04-27 02:47:34,84,53,senior and receptive and autonomous and jeering
tin good earbuds,91,4,1980-05-15 23:49:10,51,2,reliable and congested and cunning and inseparable
salmon matte case,62,5,1974-04-29 22:39:09,55,46,thirsty and humming and flooded and preliminary
tin nice crewneck,234,5,1995-06-28 10:45:11,31,11,noticeable and choppy and revolutionary and untrained
brick cool foambloack,162,1,1975-12-04 01:46:17,34,82,legitimate and refractive and enlarged and introductory
lilac older The Little Lost Hen book,136,3,2006-03-27 03:47:27,40,70,unenforceable and phonetic and vital and bland
black shiny The Hobbit book,212,2,1997-04-15 20:21:17,43,17,tactual and poisonous and beaming and groggy
beige nice legging,248,5,1975-10-23 03:11:36,81,5,informative and enthusiastic and lonely and atrocious
grass dull chair,52,2,1998-05-19 20:04:49,78,99,intricate and ingenious and cumulative and fateful
teal 5star The Camels Are Coming book,123,4,2016-10-20 03:29:57,65,88,legendary and accountable and unlivable and hot-shot
rust quality bedframe,129,3,2004-10-21 17:06:59,36,61,swanky and fuzzy and unacknowledged and astringent
salmon best shoes,150,5,1981-02-14 15:12:21,42,83,chance and contemporary and incomplete and raving
grey matte floss,195,2,2019-02-26 22:55:42,9,96,dim and expanding and provisional and horrified
black great The Ill-Made Knight book,268,3,2002-04-09 06:59:57,73,91,aromatic and quotable and thrilled and inflated
pink quality jorts,118,5,2017-04-10 09:33:54,94,29,routine and tamed and well-made and abusive
tin dull buttonup,146,2,2018-10-07 01:28:03,68,51,sparse and sudden and curable and retrogressive
beige nice toothbrush,268,3,1974-10-28 10:19:26,59,67,supersonic and certifiable and stifling and clumsy
rust best boots,65,5,1977-03-28 01:16:10,49,70,itchy and awkward and heartbreaking and shocking
cream older soundstation,278,5,1971-04-13 02:40:04,95,47,arid and yearning and routine and gilded
rust good The Camels Are Coming book,276,1,1971-05-27 19:35:15,41,87,beady and uneventful and discriminatory and medium
blue cool camisole,176,2,2015-05-02 22:09:16,7,37,unavailable and well-heeled and fastidious and several
brick older flosser,30,1,2019-07-24 23:13:27,43,46,intermittent and reactive and wry and maintainable
