yellow quality gel,64,3,1986-01-26 17:41:15,1,13,worse and incredible and mirthful and lordly
teal shiny headset,234,3,1979-08-10 04:41:44,15,79,breakable and vast and indescribable and memorable
orange cool slippers,10,5,1980-12-02 03:54:31,70,13,determined and hollow and work and incidental
brick shiny belt,49,1,1988-01-04 04:05:52,50,47,accommodating and cowering and energetic and highfalutin
maroon cool shoes,194,4,2011-10-29 13:31:49,64,27,inalterable and detestable and adoring and ripe
white matte desktop,237,5,2016-06-23 20:51:06,62,1,like-minded and viperous and upbeat and undeserved
bronze latest A Popular Schoolgirl book,25,2,2011-04-21 01:06:44,34,40,particular and nameless and awake and well-considered
yellow 5star floss,143,4,2003-12-27 17:43:58,43,82,pleasant and untested and unintelligible and defenseless
tan great foamroller,199,5,1996-02-18 19:15:24,6,61,disturbed and icky and regional and reigning
rose dull foambloack,16,3,1990-10-29 18:04:05,66,9,pregnant and dwarfish and curative and disproved
tan good dumbbell,167,4,1993-06-01 05:28:40,28,31,utilitarian and sporting and fragmented and affable
teal dull microwave,216,3,2016-05-07 12:44:55,72,7,bloated and trustworthy and money-grubbing and surprised
bronze matte moisturizer,48,1,2021-02-03 19:50:47,69,71,cocky and diminutive and unmistakable and cosmic
violet 5star projector,133,3,1976-05-23 15:34:06,46,18,withering and optimal and prestigious and simplistic
gold 5star yogamat,153,5,1973-04-23 01:48:24,11,13,scriptural and waste and wailing and sympathetic
orange cool slippers,84,4,1992-08-28 09:53:03,85,10,literal and yielding and cinematic and spotted
orange shiny desktop,96,3,2007-01-10 23:45:55,83,58,oblivious and former and numerable and involved
cream cool lotion,292,5,2019-08-22 22:52:44,3,11,shapeless and married and noncommittal and mirthful
yellow 5star floss,202,5,2001-07-11 01:23:34,12,47,crawling and decimated and worrisome and exploitative
lemon good yogamat,234,4,1999-05-22 11:50:08,45,71,lukewarm and unaltered and halfhearted and demure
tin great mousepad,146,3,1975-08-23 22:32:52,30,94,collegial and forward and snappish and shifty
oatmeal best The Abbey Series book,259,2,2018-02-05 10:30:50,83,24,condemned and widespread and snarling and disappointed
teal great retainer,249,1,1977-05-16 14:48:31,63,91,crumbly and sleepy and likeable and exterior
tan matte ladle,89,4,1978-09-06 16:27:45,91,71,flamboyant and odd and judicious and unstable
white best retainer,9,1,1992-12-27 07:40:14,14,69,venturous and disturbed and taller and partisan
khaki good fryer,193,5,2007-01-22 22:03:43,66,62,direful and overemotional and feebleminded and low-ranking
magenta nice The Tale of Squirrel Nutkin book,21,3,1984-07-04 12:55:55,72,35,implosive and momentous and inventive and excellent
gold cool case,181,1,1974-05-10 13:20:11,6,83,touchy and detached and studied and destroyed
teal nice harddrive,141,3,1993-01-04 12:59:26,17,19,wiggly and ambulatory and charging and square
orange latest sweatshirts,22,4,1998-02-06 21:15:06,8,54,formidable and outside and salted and blind
rose cool The Secret Garden book,159,3,2013-08-14 20:43:35,83,86,spoiled and exasperating and informed and bendable
blush quality projector,283,4,2004-02-13 04:22:03,77,32,mysterious and kaput and breezy and safe
coral cool suit,160,2,1987-09-29 11:09:59,72,63,bedazzling and wee and afternoon and shaggy
lime shiny cable,104,3,2008-08-27 12:48:50,42,80,unsinkable and unclassified and emaciated and hotheaded
white older projector,187,5,2006-06-09 09:28:26,78,31,defiant and prejudicial and star-crossed and neutral
red good slippers,8,4,1997-08-24 01:55:13,47,58,shrewd and diligent and domed and shortsighted
violet good jeans,58,1,2000-09-01 18:36:25,35,44,obvious and well-off and egalitarian and daily
white older shampoo,1,1,2014-05-15 08:23:53,68,39,tremulous and arduous and manipulative and posthoc
white great dongle,19,5,1998-02-07 15:35:21,33,26,"hydrothermal and many, and unintentional and reverential"
silver latest moisturizer,70,4,2016-10-16 08:31:51,31,5,due and manicured and billowy and marginal
teal quality gel,76,4,2011-09-27 15:16:08,81,42,quackish and tentative and seismic and self-directed
lilac 5star computer,116,5,2008-12-22 08:46:23,41,18,bacterial and lifeless and purified and low-calorie
charcoal quality sweater,223,3,1979-03-29 19:45:14,71,20,spacious and scanty and rewarding and spiffy
bronze latest The Sword in the Stone book,229,3,2008-07-21 02:02:26,54,47,irrepressible and enterprising and insincere and omniscient
teal matte The Wind in the Willows book,40,4,2005-02-15 09:15:31,53,28,improper and untidy and malignant and blistering
silver vintage mitts,46,2,1971-02-04 13:33:27,67,23,tiresome and vengeful and duplicitous and cheery
charcoal cool The Story of Doctor Dolittle book,205,1,1997-02-20 11:57:49,70,97,unscholarly and veracious and revised and eerie
salmon vintage The Once and Future King book,209,4,2007-03-19 03:40:23,18,26,freckled and slimy and trivial and ensuing
grass older grinder,237,3,1988-04-02 15:14:31,14,47,discriminating and kingly and uncommitted and preeminent
teal cool grinder,266,1,1973-02-08 13:46:33,69,94,photographic and triumphant and exhausting and impatient
white best bedframe,160,2,1987-10-07 01:03:04,58,40,training and feminine and objective and soaring
rust cool dongle,58,4,2010-12-14 12:41:21,16,68,integral and salty and key and excited
indigo great bandanas,106,3,1985-03-20 13:07:13,99,67,cumbersome and avid and socialist and perplexed
yellow 5star cork,90,1,1999-10-24 19:37:51,29,97,escalating and welcoming and magenta and handsome
grass dull chair,14,2,2006-06-11 14:20:13,83,70,fitted and derogatory and inhuman and perplexed
rust cool dongle,7,3,1998-01-23 03:55:59,38,55,escalating and ritualistic and valid and indestructible
red good slippers,126,5,1981-07-01 14:43:01,43,74,revengeful and absolute and reigning and adequate
brick cool dongle,126,3,1998-10-17 16:28:55,55,3,west and exasperated and equal and unaffected
violet good jeans,293,5,1990-08-07 01:19:21,100,6,specialized and undistinguished and repetitious and deaf
teal matte legging,160,2,1981-09-23 13:57:57,49,92,listless and scaly and banging and hormonal
burgundy cool buttonup,232,3,2000-01-09 08:16:59,22,45,unchangeable and tetchy and discarded and serious
gold shiny jeans,299,1,1979-10-10 13:02:12,83,58,militaristic and distinctive and chuckling and debatable
khaki 5star cable,292,3,2013-12-13 05:30:48,63,10,flaky and artless and wonderful and seven
indigo 5star lightbulb,139,1,1991-07-28 17:13:40,50,9,direful and tedious and bossy and diagonal
burgundy matte brita,267,2,2003-08-14 11:22:27,80,79,one-hour and teasing and aggravating and sisterly
orange best shirt,122,5,1994-07-27 15:30:49,58,13,marginal and noncompetitive and questionable and which
brown quality table,29,5,1979-03-06 11:15:53,46,71,suitable and noble and closed and tickling
red cool slacks,293,1,1972-09-11 02:32:45,93,54,manual and downward and harmful and inexcusable
maroon vintage shampoo,181,1,1984-12-03 04:57:40,82,34,attentive and multitalented and iron-fisted and overworked
violet great dress,156,5,2012-01-27 10:42:54,43,61,unmotivated and insignificant and flexible and fluffy
orange best buttonup,256,5,2019-06-13 04:17:22,18,92,confirmed and nameless and mumbled and identical
white older Dimsie Moves Up book,197,2,1996-10-06 08:49:05,94,6,hypnotic and legitimate and unsinkable and momentary
coral great fork,199,4,2013-03-16 01:39:06,90,87,reliable and six and compelling and prolific
pink vintage jeans,13,1,1976-05-22 20:50:10,70,1,blushing and radioactive and aching and satisfactory
violet cool pants,39,1,1986-11-26 12:27:36,93,11,flippant and purified and grumbling and symptomatic
maroon nice tablet,47,1,1983-10-11 12:13:27,56,9,full and allowable and mouthwatering and untried
teal quality endpiece,159,5,1989-11-15 22:35:10,37,35,egomaniacal and deploring and feverish and one-sided
coral great soap,186,5,1972-11-28 17:11:11,65,32,flowery and opposite and transplanted and wrong
khaki 5star The Railway Children book,80,5,2010-10-18 05:30:43,92,49,nearsighted and rare and brash and touching
burgundy good jorts,143,2,1973-08-13 19:57:42,99,32,coordinated and deceivable and approving and cohesive
lilac quality protector,60,4,1994-11-21 05:09:47,11,45,endearing and temporary and comparative and pleading
khaki matte rack,171,2,1981-12-15 03:15:23,54,62,lovable and mincing and grating and determined
blue best desk,173,1,2012-12-11 16:20:44,96,90,snoopy and sticky and aggravating and striped
white vintage flosser,74,2,2011-04-08 15:29:31,6,77,crafty and beeping and livid and winter
bronze latest A Popular Schoolgirl book,43,2,2017-03-19 19:43:53,93,22,youngest and erratic and proud and hypnotic
grey 5star chinos,81,4,2009-07-10 09:44:37,60,13,salt and retrospective and dysfunctional and vibrating
magenta cool mattress,137,4,2018-10-07 16:10:16,35,62,unseemly and firm and illegal and energizing
salmon latest The Fellowship of the Ring book,56,5,1972-04-20 16:27:09,45,97,those and several and crippled and gabby
silver best Peter and Wendy book,49,1,1987-10-07 01:42:20,53,10,stable and ultraconservative and transitional and preferable
purple cool The Tale of Peter Rabbit book,222,4,1973-11-04 15:33:47,41,79,unsubstantiated and unsuccessful and obtainable and conformable
green dull sofa,219,3,1999-03-12 02:58:26,32,3,dark and beneficial and pale and volcanic
gold great computer,34,3,1992-01-11 10:40:51,60,33,estimated and resonant and underfunded and well-argued
khaki older floss,284,2,1999-06-06 10:29:57,32,8,high and swinish and established and emergency
grey dull pill,8,5,2016-10-06 13:37:08,62,37,favorable and devoted and imposing and mumbled
brick 5star boombox,99,4,1989-12-08 22:12:15,64,42,uninterested and flammable and frugal and striped
lemon cool earphones,253,5,2004-04-16 02:43:29,17,81,emaciated and imposing and conspicuous and stuffy
beige good jacket,89,1,1979-01-24 07:10:44,7,43,willful and territorial and southeasterly and justifiable
magenta latest Just Jane book,60,5,1973-06-22 12:21:32,96,35,continuing and cluttered and tan and commanding
tin quality desktop,55,5,1991-07-03 15:37:17,71,40,adjustable and entertaining and showy and silly
gold good supplement,110,2,1986-03-03 12:28:47,77,6,swooping and ambitious and devoted and unashamed
lemon great The Lost Prince book,26,1,1975-12-04 17:22:05,79,27,thunderous and crass and frightened and undisputed
silver great legging,209,3,1986-08-20 13:31:58,16,36,attainable and time and phonemic and unsure
brick vintage router,259,2,1975-05-21 23:47:46,84,53,minute and unassisted and haunting and unjustifiable
red 5star Winnie-the-Pooh book,164,4,1972-08-16 15:43:39,6,9,quintessential and untamed and bandaged and ghostly
gold nice legging,230,5,1974-11-28 23:53:16,66,44,insipid and sorrowful and restrictive and desperate
gold shiny ties,218,4,1993-03-15 22:24:27,100,35,puny and imperial and younger and unquantifiable
teal dull smasher,275,5,2001-05-03 18:25:54,97,90,lacy and low-ranking and joyless and personal
yellow older The Queen of Air and Darkness book,161,2,1977-04-14 23:51:22,74,38,urgent and undiplomatic and calculable and deniable
yellow dull The Sword in the Stone book,173,2,2014-02-05 16:01:32,30,46,wide-ranging and creaky and crafty and shadowy
brown shiny microwave,189,3,2019-09-07 06:57:08,68,94,lucky and valuable and tardy and falsified
lime nice keyboard,93,2,2000-06-25 16:50:21,52,95,boyish and zesty and untouchable and bigger
silver vintage belt,287,3,1998-07-10 01:52:42,68,71,operatic and hotheaded and evil and untenable
lime cool table,105,5,1975-11-02 08:25:01,100,54,perennial and impetuous and impassable and charitable
brick best hairspray,179,1,1972-06-29 05:26:24,3,79,modified and applicable and liable and piteous
violet 5star Dimsie Goes To School book,182,3,2021-09-06 09:46:34,90,51,irrefutable and scarred and serial and peevish
lilac 5star smasher,149,3,2018-08-03 09:10:33,25,80,encouraging and structural and ponderous and thunderous
lilac good supplement,269,3,2003-05-08 06:37:26,66,28,whose and alienated and apathetic and paradoxical
bronze nice jogger,293,2,1998-01-27 21:48:03,12,88,flattering and antiseptic and cancelled and vindictive
salmon latest camisole,193,3,1992-01-16 19:22:15,89,99,pneumatic and recognized and tame and voluminous
brick cool jacket,283,3,1980-05-24 22:06:29,74,65,disreputable and organic and unlikely and psychiatric
bronze vintage Swallows and Amazons series book,268,5,1975-05-17 08:43:21,29,23,contented and prim and well-considered and blundering
red shiny mattress,290,1,1996-06-29 13:03:19,7,82,unwatchable and distinct and less-qualified and well-versed
gold shiny headset,116,1,1994-09-29 20:17:52,19,40,delectable and alternative and unreachable and timely
teal vintage brita,268,1,2009-08-20 08:52:28,20,28,haunting and theological and illicit and thoughtful
bronze matte lotion,68,4,1978-02-02 20:20:24,74,84,nimble and phonemic and lacking and successful
blue dull fryer,66,5,1972-10-27 01:19:22,16,100,outward and deaf and poetic and hated
bronze dull vitamin,294,4,1976-02-08 23:23:22,70,94,defeated and unmerciful and hearty and ultimate
teal vintage booties,242,5,1979-08-26 23:06:51,52,71,rowdy and geometric and revolting and betteroff
white older Dimsie Moves Up book,158,1,1973-11-12 08:22:35,50,97,taut and motionless and sonly and north
cream dull slacks,221,4,2014-08-15 02:07:20,90,23,masterful and yearning and unfocused and insufficient
teal dull smasher,227,5,1985-05-02 21:15:48,73,9,adventurous and blonde and fainthearted and unspoiled
teal cool Swallows and Amazons book,43,4,2012-12-17 07:18:01,26,41,inflamed and unseasonable and vicious and snappish
orange best floss,166,5,2002-05-15 06:21:13,18,62,fried and high and egocentric and complicated
oatmeal great soap,113,3,1986-10-18 03:11:29,96,26,luscious and magnanimous and consumable and weird
orange best floss,203,3,1973-07-25 19:27:24,23,5,insipid and shivery and eventful and unconventional
red 5star camera,168,3,2019-02-16 02:05:47,32,30,symmetrical and cloudy and faded and sensitive
oatmeal cool floss,235,4,1988-12-04 06:52:12,67,47,gullible and unconquerable and inexpressive and expanded
grey dull pill,236,2,2001-08-27 13:07:19,94,54,banned and committed and generous and reflective
magenta cool The Camels Are Coming book,155,3,1983-05-09 08:07:57,26,13,felonious and unreliable and expeditious and unwieldy
yellow great tanktop,154,5,2015-07-16 17:02:53,7,99,principal and disinclined and humid and remaining
pink vintage spatula,125,2,2012-03-11 16:15:36,14,3,unanimous and unimaginable and scribbled and ultrasensitive
gold shiny hoody,192,3,1992-07-06 11:07:25,41,40,nonproductive and surrealistic and problematic and sad
silver older tablet,98,4,1999-05-13 23:31:01,72,23,omnivorous and untimely and successive and cut
tin cool Peter Pan in Kensington Gardens book,248,2,2005-05-13 14:20:41,20,45,shadowed and pressing and sufficient and antisocial
tan dull The Tale of Tom Kitten book,235,3,1970-11-06 01:44:22,90,67,unsatisfactory and mercurial and athletic and disgruntled
blue matte protector,26,1,1997-08-27 04:53:24,44,20,sufficient and toothy and demented and responsible
gold latest rack,25,1,2008-04-06 16:42:32,39,22,virtual and unappealing and managerial and perfumed
lilac 5star smasher,196,5,1991-08-22 07:52:06,96,26,honorable and visionary and deploring and well-maintained
blue shiny The Fellowship of the Ring book,105,4,2004-07-06 06:50:32,65,70,diminishing and subject and invited and autonomous
rose best earbuds,37,1,1995-01-26 13:49:44,23,72,well-rounded and richer and spotless and latter
maroon matte The Wind in the Willows book,87,4,1993-06-10 04:26:44,28,3,standoffish and tiresome and inquiring and woeful
black vintage The Story of Doctor Dolittle book,179,4,1977-09-07 09:54:40,41,97,arresting and tiresome and pitiless and peevish
lime cool tshirt,159,2,2020-04-16 10:53:04,78,42,costly and cocky and succulent and savory
oatmeal best The Abbey Series book,146,2,1974-06-24 09:54:14,100,76,iron and dysfunctional and gangly and repentant
yellow good phone,221,2,1990-11-02 09:45:12,85,54,variable and slimy and sulky and seething
black great shorts,67,2,1987-12-10 22:25:18,10,80,trapped and continuous and prepared and immortal
tin 5star mousse,131,5,2008-09-19 21:03:47,63,62,crabby and uncluttered and startling and boundless
tan shiny booties,53,1,2007-10-05 02:17:55,76,15,unappetizing and saintly and tanned and delinquent
charcoal cool The Story of Doctor Dolittle book,157,1,2021-06-25 11:55:10,11,32,vitriolic and impartial and humid and cuddly
maroon great flosser,47,1,1980-08-03 22:26:18,55,72,stodgy and linguistic and nine and snooty
"grass 5star ""The Little Bookroom book",299,2,1990-05-01 02:28:04,10,7,multitalented and extension and spatial and pitiful
blush quality moisturizer,286,3,1993-04-09 20:57:12,35,81,parched and unstoppable and ridiculous and bright
green 5star dress,67,1,1989-09-05 09:34:18,90,58,terrible and sorrowful and sanitary and breathtaking
orange quality microwave,140,4,1970-02-07 05:15:09,39,52,uninhabitable and irreconcilable and artless and threatened
grass vintage foamroller,206,5,2016-02-17 20:21:55,83,28,vacuous and courteous and unreachable and inflexible
pink cool socks,110,3,1981-09-18 20:09:08,51,21,well-adjusted and promising and potent and worrying
cream dull The Queen of Air and Darkness book,158,4,1999-04-20 14:19:01,45,41,ruthless and sore and enthused and frigid
charcoal matte A Little Princess book,79,3,2004-06-02 10:55:19,63,70,sober and wet and instant and luminescent
bronze quality fryer,138,1,2012-07-16 03:46:40,31,3,somatic and unadvised and muscular and competent
yellow cool projector,65,2,2001-05-15 04:29:59,98,80,valuable and this and internal and astringent
blush good Meredith and Co. book,268,4,1977-08-19 08:01:17,81,8,tidal and grateful and intelligible and unpersuasive
brown 5star The Fellowship of the Ring book,9,5,2017-11-23 04:53:06,43,58,phenomenal and inescapable and civilian and doting
green cool ladle,238,5,1984-09-25 20:48:04,69,23,pompous and contractual and sonic and blamable
rust matte mousepad,72,2,2002-02-12 17:19:01,10,6,binary and questionable and earthy and rampant
silver nice sweatshirts,193,5,2017-11-07 02:25:58,55,50,unnecessary and flying and fat and certifiable
green latest camisole,233,4,2018-04-10 01:21:28,31,58,lined and ineffectual and imperceptive and satisfying
violet latest supplement,150,3,2011-05-23 04:39:21,16,25,bedazzling and ideal and muttering and painstaking
indigo best belt,99,1,1980-12-21 06:55:53,47,10,unsafe and inflated and salted and nebulous
silver great legging,251,1,1974-02-22 19:47:07,46,88,peculiar and broken and the and uninitiated
indigo shiny Winnie-the-Pooh book,33,2,1976-09-23 04:53:32,95,61,alike and irascible and nameless and frisky
burgundy great boombox,278,4,2007-08-14 19:10:05,3,1,tanned and muggy and yielding and nutritional
orange best floss,7,2,2014-01-24 06:17:34,14,78,invigorating and mistaken and frisky and dear
oatmeal matte floss,194,1,2010-01-18 20:50:14,15,37,interdepartmental and mournful and proportionate and transient
lilac cool shorts,174,5,1983-06-29 08:52:53,54,16,fruitful and congenial and indecipherable and swift
grey cool harddrive,64,5,2002-04-04 21:59:06,23,34,nonverbal and sparkly and unexceptional and spattered
red good slippers,203,3,2015-06-19 10:20:50,72,90,nautical and inoffensive and exuberant and prejudicial
charcoal nice hairspray,240,4,2009-06-20 08:48:08,50,13,logistic and imaginable and external and unredeemable
lime vintage microwave,209,2,1989-07-28 15:50:01,68,81,wheezing and unused and uncouth and savvy
lemon older hoody,83,1,1975-08-15 14:17:03,67,76,street and classic and middle and overcrowded
magenta latest Just Jane book,187,2,1992-10-15 02:15:26,30,22,justifiable and standoffish and illuminating and up-to-date
grey best Meredith and Co. book,165,5,1974-04-12 04:43:43,87,2,imperial and dorsal and no and sandy
silver nice sweatshirts,98,1,1999-07-02 02:16:17,21,31,affectionate and overcrowded and inauspicious and well-prepared
gold cool dumbbell,49,3,1999-09-13 05:27:43,99,76,steel and boastful and biodegradable and symmetrical
oatmeal best The Abbey Series book,4,3,2001-09-12 11:24:05,69,28,coercive and wandering and plain and suffering
brick vintage tablet,91,2,2020-02-21 09:25:35,60,49,effusive and belching and uninterrupted and unceasing
burgundy cool sieve,186,5,1973-08-09 08:05:43,51,26,odd and knobby and bilingual and baffling
rose cool cable,123,3,1990-04-21 01:38:22,8,4,unprincipled and frilly and miserly and dressy
black great The School at the Chalet book,21,1,2013-04-29 07:25:42,63,58,apologetic and concealed and hungry and closed
burgundy great hairspray,46,5,2014-10-07 13:43:14,54,51,indecipherable and contagious and biblical and icy-cold
bronze best camisole,120,4,2004-02-26 05:30:06,91,56,steadfast and unemotional and rare and unblinking
bronze latest The Sword in the Stone book,42,1,1989-08-11 23:58:23,20,43,covert and improper and destroyed and obeisant
maroon matte lotion,158,3,2012-07-26 12:31:16,43,53,persevering and valorous and inner and damaged
oatmeal great The Railway Children book,132,2,1987-09-24 04:15:36,8,48,unalterable and disappointed and accused and gnarly
lime cool The Tale of Mrs. Tiggy-Winkle book,174,2,2009-04-18 05:26:02,4,95,troublesome and disdainful and solid and meaningful
purple 5star Swallows and Amazons book,134,2,1973-01-11 22:52:24,69,3,heartless and outgoing and soakingwet and merry
gold vintage Swallows and Amazons series book,77,3,2007-06-04 20:45:09,18,26,full and generous and intangible and nonabrasive
brown vintage shorts,26,5,2015-04-04 07:09:49,36,66,splendid and sole and inconsistent and stacked
brown latest speaker,210,2,1987-02-19 09:13:08,87,7,oily and ridiculous and cumbersome and adored
oatmeal nice foambloack,130,4,2021-08-21 08:45:50,4,72,speculative and prospective and silver-tongued and perturbed
burgundy best earbuds,12,1,1986-03-14 15:24:47,35,100,"many, and political and engaging and deadpan"
white matte desktop,86,5,1995-06-28 01:47:09,34,3,kitchen and distrustful and metaphoric and brunette
yellow 5star bookshelf,43,1,1999-03-04 21:17:18,40,1,well-lit and wandering and unpleasant and ceaseless
cream good boombox,273,1,2019-07-21 08:14:33,54,17,flamboyant and indefensible and motivational and conscious
violet best dongle,256,1,1998-05-11 12:03:19,83,19,individualistic and amusing and charitable and chief
grey good computer,262,2,1997-05-27 10:05:41,2,88,precarious and selfless and cavernous and depressing
brown matte boombox,95,1,2020-02-11 05:11:56,37,36,next and deadpan and influential and well-argued
brick older moisturizer,26,4,1986-05-17 11:38:15,23,90,wailing and external and swaying and pressurized
coral shiny sink,84,2,1970-07-08 07:19:08,100,5,curable and high and divided and unobserved
brick good The Tale of the Pie and the Patty-Pan book,295,2,2021-09-29 18:04:11,58,26,crossed and violet and outgoing and overassertive
rust great The Queen of Air and Darkness book,108,2,2003-08-01 21:17:33,3,63,bewitching and reigning and slippery and neither
tan great foamroller,167,1,1983-10-28 15:19:22,18,80,outrageous and short-lived and invincible and stodgy
brown great grinder,79,2,1971-01-23 19:02:30,24,1,streaked and effusive and indicative and normal
coral cool khakis,61,1,2013-12-27 03:13:07,90,82,astringent and secretive and imported and brief
white quality trousers,257,4,1989-09-01 07:33:31,62,2,inconceivable and stilted and affectionate and disarming
green latest kettlebell,77,2,1988-06-16 05:29:43,32,2,limited and gruesome and psychedelic and winning
salmon 5star desktop,52,3,1972-03-08 21:37:19,36,61,caustic and reversible and fanatical and unprincipled
orange quality buttondown,17,5,1983-06-09 04:54:06,61,38,eternal and jagged and repugnant and own
silver matte watch,68,2,2004-01-15 02:30:46,100,22,great and suspected and stormy and stringent
bronze vintage projector,269,4,2004-06-19 19:51:41,45,9,fully-grown and sea and quotable and illiterate
gold great computer,82,1,1970-05-08 20:22:10,73,34,nonviolent and troubling and eerie and drained
rose best The Story of the Amulet book,123,1,1979-05-16 15:15:03,17,31,wrenching and high and pluralistic and crowded
red cool The Tale of Squirrel Nutkin book,228,3,1976-02-25 17:34:55,12,51,anticlimactic and official and gallant and interchangeable
bronze 5star candle,121,2,2010-10-21 10:36:04,84,79,weak and undisciplined and tolerable and universal
purple shiny bedframe,182,5,1991-05-12 09:11:31,43,97,gratis and prickly and pyrotechnic and sarcastic
grey best sweater,88,2,1993-06-23 02:39:13,14,3,incredible and inglorious and frequent and gaunt
gold nice volumizer,65,3,1986-05-16 08:02:03,45,16,lousy and plump and generous and unsuspecting
lilac vintage laptop,59,1,1981-04-20 14:29:17,77,90,native and prim and terrified and quick-acting
grey dull pill,88,3,2012-08-03 03:39:44,27,48,needy and plausible and wolfish and winter
red older The Little Lost Hen book,177,4,2007-12-10 07:12:26,36,54,romantic and obtainable and adaptive and undistinguished
oatmeal nice foambloack,112,1,2017-03-07 01:54:29,21,59,corrective and stoic and rational and intuitive
grass older jogger,184,2,1988-07-18 22:25:24,82,14,errant and medicinal and vile and even
khaki 5star cable,37,1,1979-07-08 03:29:13,40,9,official and unverified and chubby and advisable
khaki vintage dumbbell,225,4,2005-07-03 02:15:43,60,80,shabby and cohesive and blossoming and uninitiated
rose good glass,178,5,2000-12-02 06:04:35,81,39,enthused and culpable and unquenchable and linguistic
