violet dull The Abbey Series book,books,url,False,violet dull The Abbey Series book
"white best ""The Little Bookroom book",books,url,False,"white best ""The Little Bookroom book"
brick great The Wind in the Willows book,books,url,False,brick great The Wind in the Willows book
tin best The Story of the Amulet book,books,url,False,tin best The Story of the Amulet book
orange matte The Return of the King book,books,url,True,orange matte The Return of the King book
cream great The Tale of Tom Kitten book,books,url,True,cream great The Tale of Tom Kitten book
lilac latest Meredith and Co. book,books,url,False,lilac latest Meredith and Co. book
pink matte Old Peter's Russian Tales book,books,url,True,pink matte Old Peter's Russian Tales book
lemon shiny Billy Bunter of Greyfriars School book,books,url,True,lemon shiny Billy Bunter of Greyfriars School book
brown latest The Tailor of Gloucester book,books,url,True,brown latest The Tailor of Gloucester book
brick cool The Tale of Mrs. Tiggy-Winkle book,books,url,True,brick cool The Tale of Mrs. Tiggy-Winkle book
khaki shiny A Little Princess book,books,url,False,khaki shiny A Little Princess book
"oatmeal vintage ""The Little Bookroom book",books,url,False,"oatmeal vintage ""The Little Bookroom book"
gold shiny The House at Pooh Corner book,books,url,False,gold shiny The House at Pooh Corner book
magenta matte The Railway Children book,books,url,False,magenta matte The Railway Children book
khaki dull Dimsie Moves Up book,books,url,False,khaki dull Dimsie Moves Up book
burgundy best The Tale of Squirrel Nutkin book,books,url,True,burgundy best The Tale of Squirrel Nutkin book
tan good Five Children and It book,books,url,False,tan good Five Children and It book
grey older The Fellowship of the Ring book,books,url,True,grey older The Fellowship of the Ring book
orange vintage The Two Towers book,books,url,False,orange vintage The Two Towers book
grass vintage Five on a Treasure Island book,books,url,False,grass vintage Five on a Treasure Island book
oatmeal nice Swallows and Amazons series book,books,url,False,oatmeal nice Swallows and Amazons series book
black 5star The Story of Doctor Dolittle book,books,url,True,black 5star The Story of Doctor Dolittle book
orange shiny Brendon Chase book,books,url,True,orange shiny Brendon Chase book
rust dull The Tale of Mrs. Tiggy-Winkle book,books,url,True,rust dull The Tale of Mrs. Tiggy-Winkle book
grey good The Queen of Air and Darkness book,books,url,False,grey good The Queen of Air and Darkness book
brown cool Swallows and Amazons book,books,url,True,brown cool Swallows and Amazons book
grass cool The Secret Garden book,books,url,True,grass cool The Secret Garden book
blush matte The Sword in the Stone book,books,url,False,blush matte The Sword in the Stone book
teal good The Hobbit book,books,url,False,teal good The Hobbit book
salmon good The Candle in the Wind book,books,url,False,salmon good The Candle in the Wind book
white latest No Boats on Bannermere book,books,url,True,white latest No Boats on Bannermere book
green good Billy Bunter of Greyfriars School book,books,url,True,green good Billy Bunter of Greyfriars School book
indigo vintage No Boats on Bannermere book,books,url,True,indigo vintage No Boats on Bannermere book
tan quality The Camels Are Coming book,books,url,True,tan quality The Camels Are Coming book
lilac great The Story of the Amulet book,books,url,False,lilac great The Story of the Amulet book
oatmeal matte Peter Pan in Kensington Gardens book,books,url,False,oatmeal matte Peter Pan in Kensington Gardens book
gold matte Brendon Chase book,books,url,True,gold matte Brendon Chase book
silver shiny Dimsie Goes To School book,books,url,False,silver shiny Dimsie Goes To School book
charcoal quality The Little Grey Men book,books,url,False,charcoal quality The Little Grey Men book
brick dull The Little Lost Hen book,books,url,False,brick dull The Little Lost Hen book
silver matte The Queen of Air and Darkness book,books,url,True,silver matte The Queen of Air and Darkness book
maroon nice Biggles Flies East book,books,url,True,maroon nice Biggles Flies East book
rust matte Just Jane book,books,url,False,rust matte Just Jane book
lilac 5star Brendon Chase book,books,url,False,lilac 5star Brendon Chase book
tan nice A Little Princess book,books,url,True,tan nice A Little Princess book
brown great The Once and Future King book,books,url,True,brown great The Once and Future King book
maroon matte The Camels Are Coming book,books,url,True,maroon matte The Camels Are Coming book
black 5star The Candle in the Wind book,books,url,False,black 5star The Candle in the Wind book
black latest The Tale of Tom Kitten book,books,url,False,black latest The Tale of Tom Kitten book
grass great The Tale of Mrs. Tiggy-Winkle book,books,url,False,grass great The Tale of Mrs. Tiggy-Winkle book
maroon nice Just Jane book,books,url,True,maroon nice Just Jane book
salmon cool The Lord of the Rings book,books,url,True,salmon cool The Lord of the Rings book
black vintage The Wind in the Willows book,books,url,False,black vintage The Wind in the Willows book
magenta great The Secret Garden book,books,url,True,magenta great The Secret Garden book
coral 5star Just Jane book,books,url,True,coral 5star Just Jane book
lilac great Biggles Flies East book,books,url,False,lilac great Biggles Flies East book
tan 5star Billy Bunter of Greyfriars School book,books,url,True,tan 5star Billy Bunter of Greyfriars School book
blue shiny Swallows and Amazons book,books,url,True,blue shiny Swallows and Amazons book
oatmeal matte The Lost Prince book,books,url,False,oatmeal matte The Lost Prince book
violet matte The Little Grey Men book,books,url,True,violet matte The Little Grey Men book
orange cool A Little Princess book,books,url,False,orange cool A Little Princess book
tan nice Biggles Flies East book,books,url,True,tan nice Biggles Flies East book
white great The Mystery of the Burnt Cottage book,books,url,True,white great The Mystery of the Burnt Cottage book
orange shiny The Fellowship of the Ring book,books,url,False,orange shiny The Fellowship of the Ring book
beige nice Biggles Flies East book,books,url,True,beige nice Biggles Flies East book
indigo good Swallowdale book,books,url,True,indigo good Swallowdale book
purple matte The Lord of the Rings book,books,url,True,purple matte The Lord of the Rings book
"white shiny The Squirrel, The Hare and the Little Grey Rabbit book",books,url,False,"white shiny The Squirrel, The Hare and the Little Grey Rabbit book"
tan dull The Candle in the Wind book,books,url,False,tan dull The Candle in the Wind book
blue matte The Railway Children book,books,url,False,blue matte The Railway Children book
bronze good Billy Bunter of Greyfriars School book,books,url,False,bronze good Billy Bunter of Greyfriars School book
purple 5star The House at Pooh Corner book,books,url,False,purple 5star The House at Pooh Corner book
blush matte The Camels Are Coming book,books,url,False,blush matte The Camels Are Coming book
"charcoal latest ""The Little Bookroom book",books,url,False,"charcoal latest ""The Little Bookroom book"
pink best Just William book,books,url,True,pink best Just William book
tan dull The Hobbit book,books,url,True,tan dull The Hobbit book
bronze best Five on a Treasure Island book,books,url,True,bronze best Five on a Treasure Island book
tan cool The Secret Garden book,books,url,True,tan cool The Secret Garden book
blue vintage The Tale of Mrs. Tiggy-Winkle book,books,url,False,blue vintage The Tale of Mrs. Tiggy-Winkle book
white best Brendon Chase book,books,url,True,white best Brendon Chase book
coral nice Swallowdale book,books,url,True,coral nice Swallowdale book
purple shiny The Lost Prince book,books,url,True,purple shiny The Lost Prince book
charcoal vintage The Abbey Series book,books,url,False,charcoal vintage The Abbey Series book
oatmeal quality The Ill-Made Knight book,books,url,True,oatmeal quality The Ill-Made Knight book
maroon dull The Magic World book,books,url,False,maroon dull The Magic World book
white matte Five on a Treasure Island book,books,url,False,white matte Five on a Treasure Island book
brick dull Dimsie Goes To School book,books,url,True,brick dull Dimsie Goes To School book
khaki latest The Ill-Made Knight book,books,url,False,khaki latest The Ill-Made Knight book
purple shiny The Once and Future King book,books,url,True,purple shiny The Once and Future King book
grass nice The Little Lost Hen book,books,url,False,grass nice The Little Lost Hen book
magenta good The School at the Chalet book,books,url,True,magenta good The School at the Chalet book
cream older A Popular Schoolgirl book,books,url,False,cream older A Popular Schoolgirl book
"rust good ""The Little Bookroom book",books,url,False,"rust good ""The Little Bookroom book"
silver 5star Winnie-the-Pooh book,books,url,True,silver 5star Winnie-the-Pooh book
brown latest The House at Pooh Corner book,books,url,True,brown latest The House at Pooh Corner book
magenta great A Little Princess book,books,url,False,magenta great A Little Princess book
rust best Dimsie Goes To School book,books,url,False,rust best Dimsie Goes To School book
yellow dull The Tale of Mrs. Tiggy-Winkle book,books,url,True,yellow dull The Tale of Mrs. Tiggy-Winkle book
yellow dull The Magic World book,books,url,True,yellow dull The Magic World book
tan older The Magic World book,books,url,False,tan older The Magic World book
rose matte The Tale of Peter Rabbit book,books,url,True,rose matte The Tale of Peter Rabbit book
magenta nice The Hobbit book,books,url,False,magenta nice The Hobbit book
brown great The Tale of Squirrel Nutkin book,books,url,True,brown great The Tale of Squirrel Nutkin book
silver 5star The Wind in the Willows book,books,url,True,silver 5star The Wind in the Willows book
lime older Just William book,books,url,True,lime older Just William book
indigo vintage The Tale of Peter Rabbit book,books,url,False,indigo vintage The Tale of Peter Rabbit book
indigo quality Peter Pan in Kensington Gardens book,books,url,True,indigo quality Peter Pan in Kensington Gardens book
green latest Five Children and It book,books,url,True,green latest Five Children and It book
violet best Peter Pan in Kensington Gardens book,books,url,False,violet best Peter Pan in Kensington Gardens book
oatmeal great Brendon Chase book,books,url,True,oatmeal great Brendon Chase book
burgundy vintage Dimsie Goes To School book,books,url,True,burgundy vintage Dimsie Goes To School book
brown older Five Children and It book,books,url,False,brown older Five Children and It book
grey good The Tale of Mrs. Tiggy-Winkle book,books,url,True,grey good The Tale of Mrs. Tiggy-Winkle book
lime cool Winnie-the-Pooh book,books,url,False,lime cool Winnie-the-Pooh book
tan good The Hobbit book,books,url,False,tan good The Hobbit book
blush shiny The Candle in the Wind book,books,url,False,blush shiny The Candle in the Wind book
green vintage Just William book,books,url,True,green vintage Just William book
silver cool The Little Lost Hen book,books,url,True,silver cool The Little Lost Hen book
red shiny The Sword in the Stone book,books,url,True,red shiny The Sword in the Stone book
oatmeal older The Lord of the Rings book,books,url,False,oatmeal older The Lord of the Rings book
blue latest Just Jane book,books,url,True,blue latest Just Jane book
tan shiny Five Children and It book,books,url,False,tan shiny Five Children and It book
"green dull ""The Little Bookroom book",books,url,True,"green dull ""The Little Bookroom book"
coral latest The Fellowship of the Ring book,books,url,True,coral latest The Fellowship of the Ring book
beige shiny A Little Princess book,books,url,False,beige shiny A Little Princess book
maroon matte The Abbey Series book,books,url,False,maroon matte The Abbey Series book
orange good Dimsie Goes To School book,books,url,True,orange good Dimsie Goes To School book
tin dull The Wind in the Willows book,books,url,True,tin dull The Wind in the Willows book
white best The Fellowship of the Ring book,books,url,False,white best The Fellowship of the Ring book
rose cool Dimsie Moves Up book,books,url,True,rose cool Dimsie Moves Up book
teal older The Fellowship of the Ring book,books,url,True,teal older The Fellowship of the Ring book
"violet good The Squirrel, The Hare and the Little Grey Rabbit book",books,url,True,"violet good The Squirrel, The Hare and the Little Grey Rabbit book"
gold shiny The Sword in the Stone book,books,url,True,gold shiny The Sword in the Stone book
tan shiny The School at the Chalet book,books,url,True,tan shiny The School at the Chalet book
rose good Peter Pan in Kensington Gardens book,books,url,False,rose good Peter Pan in Kensington Gardens book
grass latest Biggles Flies East book,books,url,False,grass latest Biggles Flies East book
teal dull The Ill-Made Knight book,books,url,True,teal dull The Ill-Made Knight book
lemon cool The Tailor of Gloucester book,books,url,False,lemon cool The Tailor of Gloucester book
rust shiny Meredith and Co. book,books,url,False,rust shiny Meredith and Co. book
tin dull The Abbey Series book,books,url,False,tin dull The Abbey Series book
brick best Brendon Chase book,books,url,False,brick best Brendon Chase book
black dull Dimsie Moves Up book,books,url,True,black dull Dimsie Moves Up book
brick good Five on a Treasure Island book,books,url,False,brick good Five on a Treasure Island book
black good The Wind in the Willows book,books,url,True,black good The Wind in the Willows book
coral good Dimsie Moves Up book,books,url,False,coral good Dimsie Moves Up book
pink 5star The Tale of Mrs. Tiggy-Winkle book,books,url,False,pink 5star The Tale of Mrs. Tiggy-Winkle book
oatmeal good The Lord of the Rings book,books,url,False,oatmeal good The Lord of the Rings book
yellow matte The Candle in the Wind book,books,url,False,yellow matte The Candle in the Wind book
indigo shiny The School at the Chalet book,books,url,False,indigo shiny The School at the Chalet book
burgundy best The Tale of Tom Kitten book,books,url,True,burgundy best The Tale of Tom Kitten book
indigo great The Camels Are Coming book,books,url,False,indigo great The Camels Are Coming book
magenta latest The Story of the Amulet book,books,url,False,magenta latest The Story of the Amulet book
coral cool Swallows and Amazons book,books,url,True,coral cool Swallows and Amazons book
red vintage The Little Lost Hen book,books,url,False,red vintage The Little Lost Hen book
oatmeal great The Once and Future King book,books,url,False,oatmeal great The Once and Future King book
purple cool The Fellowship of the Ring book,books,url,False,purple cool The Fellowship of the Ring book
lilac matte Dimsie Goes To School book,books,url,True,lilac matte Dimsie Goes To School book
teal quality The Candle in the Wind book,books,url,True,teal quality The Candle in the Wind book
oatmeal nice The Story of Doctor Dolittle book,books,url,True,oatmeal nice The Story of Doctor Dolittle book
cream older The Abbey Series book,books,url,False,cream older The Abbey Series book
brick vintage Five on a Treasure Island book,books,url,True,brick vintage Five on a Treasure Island book
lemon dull Dimsie Goes To School book,books,url,False,lemon dull Dimsie Goes To School book
rust good The Tailor of Gloucester book,books,url,True,rust good The Tailor of Gloucester book
lilac cool The Tale of the Pie and the Patty-Pan book,books,url,False,lilac cool The Tale of the Pie and the Patty-Pan book
lilac quality The Abbey Series book,books,url,False,lilac quality The Abbey Series book
bronze great The Story of Doctor Dolittle book,books,url,True,bronze great The Story of Doctor Dolittle book
red quality The Candle in the Wind book,books,url,False,red quality The Candle in the Wind book
grey cool Swallowdale book,books,url,True,grey cool Swallowdale book
black best The Camels Are Coming book,books,url,True,black best The Camels Are Coming book
brown good The Tale of Mrs. Tiggy-Winkle book,books,url,True,brown good The Tale of Mrs. Tiggy-Winkle book
violet 5star The Little Lost Hen book,books,url,True,violet 5star The Little Lost Hen book
"pink latest The Squirrel, The Hare and the Little Grey Rabbit book",books,url,True,"pink latest The Squirrel, The Hare and the Little Grey Rabbit book"
orange great The Tailor of Gloucester book,books,url,True,orange great The Tailor of Gloucester book
salmon vintage The Railway Children book,books,url,True,salmon vintage The Railway Children book
blue great The Queen of Air and Darkness book,books,url,True,blue great The Queen of Air and Darkness book
pink matte Dimsie Goes To School book,books,url,True,pink matte Dimsie Goes To School book
indigo cool The Tale of Tom Kitten book,books,url,True,indigo cool The Tale of Tom Kitten book
silver dull The Ill-Made Knight book,books,url,False,silver dull The Ill-Made Knight book
orange vintage The Story of the Amulet book,books,url,False,orange vintage The Story of the Amulet book
maroon shiny Biggles Flies East book,books,url,False,maroon shiny Biggles Flies East book
black vintage The Tale of Peter Rabbit book,books,url,False,black vintage The Tale of Peter Rabbit book
violet best Old Peter's Russian Tales book,books,url,True,violet best Old Peter's Russian Tales book
lemon dull The House at Pooh Corner book,books,url,False,lemon dull The House at Pooh Corner book
charcoal good The Tale of the Pie and the Patty-Pan book,books,url,True,charcoal good The Tale of the Pie and the Patty-Pan book
khaki 5star Just William book,books,url,True,khaki 5star Just William book
khaki matte Dimsie Goes To School book,books,url,False,khaki matte Dimsie Goes To School book
white nice The Tale of the Pie and the Patty-Pan book,books,url,True,white nice The Tale of the Pie and the Patty-Pan book
grey 5star The Lost Prince book,books,url,False,grey 5star The Lost Prince book
lemon 5star The Candle in the Wind book,books,url,True,lemon 5star The Candle in the Wind book
purple nice Brendon Chase book,books,url,False,purple nice Brendon Chase book
bronze great A Little Princess book,books,url,False,bronze great A Little Princess book
khaki dull The Abbey Series book,books,url,False,khaki dull The Abbey Series book
beige latest Swallows and Amazons book,books,url,False,beige latest Swallows and Amazons book
maroon older The Wind in the Willows book,books,url,True,maroon older The Wind in the Willows book
"black quality The Squirrel, The Hare and the Little Grey Rabbit book",books,url,False,"black quality The Squirrel, The Hare and the Little Grey Rabbit book"
rose good Five Children and It book,books,url,True,rose good Five Children and It book
lilac quality Peter Pan in Kensington Gardens book,books,url,False,lilac quality Peter Pan in Kensington Gardens book
beige latest The Tale of the Pie and the Patty-Pan book,books,url,True,beige latest The Tale of the Pie and the Patty-Pan book
lemon quality The Story of Doctor Dolittle book,books,url,False,lemon quality The Story of Doctor Dolittle book
tan 5star The Little Grey Men book,books,url,True,tan 5star The Little Grey Men book
maroon nice The Return of the King book,books,url,False,maroon nice The Return of the King book
tan 5star Peter and Wendy book,books,url,False,tan 5star Peter and Wendy book
burgundy quality Five Children and It book,books,url,True,burgundy quality Five Children and It book
orange nice Biggles Flies East book,books,url,False,orange nice Biggles Flies East book
tin great Swallowdale book,books,url,False,tin great Swallowdale book
brick great The Camels Are Coming book,books,url,True,brick great The Camels Are Coming book
beige great Swallows and Amazons book,books,url,False,beige great Swallows and Amazons book
black matte Old Peter's Russian Tales book,books,url,True,black matte Old Peter's Russian Tales book
magenta nice The Secret Garden book,books,url,True,magenta nice The Secret Garden book
lilac shiny The Magic World book,books,url,False,lilac shiny The Magic World book
grey matte The Hobbit book,books,url,False,grey matte The Hobbit book
"beige older ""The Little Bookroom book",books,url,True,"beige older ""The Little Bookroom book"
lemon best Dimsie Moves Up book,books,url,False,lemon best Dimsie Moves Up book
lilac matte Brendon Chase book,books,url,False,lilac matte Brendon Chase book
violet older The Secret Garden book,books,url,False,violet older The Secret Garden book
yellow good The Queen of Air and Darkness book,books,url,True,yellow good The Queen of Air and Darkness book
black 5star Swallows and Amazons series book,books,url,True,black 5star Swallows and Amazons series book
red great Peter Pan in Kensington Gardens book,books,url,True,red great Peter Pan in Kensington Gardens book
violet good The Ill-Made Knight book,books,url,False,violet good The Ill-Made Knight book
tin nice The Story of Doctor Dolittle book,books,url,True,tin nice The Story of Doctor Dolittle book
khaki shiny The House at Pooh Corner book,books,url,False,khaki shiny The House at Pooh Corner book
tin latest Swallows and Amazons series book,books,url,True,tin latest Swallows and Amazons series book
rose dull Biggles Flies East book,books,url,False,rose dull Biggles Flies East book
grass latest The Railway Children book,books,url,False,grass latest The Railway Children book
lime vintage The Tale of Mrs. Tiggy-Winkle book,books,url,False,lime vintage The Tale of Mrs. Tiggy-Winkle book
violet older The Tale of Squirrel Nutkin book,books,url,False,violet older The Tale of Squirrel Nutkin book
teal dull The Little Lost Hen book,books,url,False,teal dull The Little Lost Hen book
magenta good The Little Lost Hen book,books,url,True,magenta good The Little Lost Hen book
rose older Old Peter's Russian Tales book,books,url,True,rose older Old Peter's Russian Tales book
tan dull Five Children and It book,books,url,False,tan dull Five Children and It book
cream good No Boats on Bannermere book,books,url,False,cream good No Boats on Bannermere book
salmon cool The Tale of Tom Kitten book,books,url,False,salmon cool The Tale of Tom Kitten book
grey dull The House at Pooh Corner book,books,url,True,grey dull The House at Pooh Corner book
teal latest The Sword in the Stone book,books,url,True,teal latest The Sword in the Stone book
rose 5star The Tale of Tom Kitten book,books,url,True,rose 5star The Tale of Tom Kitten book
coral matte The Little Grey Men book,books,url,True,coral matte The Little Grey Men book
tin shiny The Once and Future King book,books,url,False,tin shiny The Once and Future King book
lilac older The Camels Are Coming book,books,url,True,lilac older The Camels Are Coming book
purple quality Swallowdale book,books,url,False,purple quality Swallowdale book
white good Dimsie Moves Up book,books,url,False,white good Dimsie Moves Up book
green great Brendon Chase book,books,url,False,green great Brendon Chase book
silver good A Little Princess book,books,url,True,silver good A Little Princess book
lilac older Five Children and It book,books,url,False,lilac older Five Children and It book
gold best The Lost Prince book,books,url,False,gold best The Lost Prince book
black nice Just Jane book,books,url,False,black nice Just Jane book
blush shiny The Once and Future King book,books,url,True,blush shiny The Once and Future King book
violet dull The Story of the Amulet book,books,url,True,violet dull The Story of the Amulet book
blue quality Dimsie Goes To School book,books,url,False,blue quality Dimsie Goes To School book
black matte rack,household,url,True,black matte rack
magenta cool mattress,household,url,False,magenta cool mattress
brick latest whisk,household,url,False,brick latest whisk
rose great fork,household,url,True,rose great fork
yellow dull mitts,household,url,True,yellow dull mitts
yellow vintage lamp,household,url,False,yellow vintage lamp
lemon nice lightbulb,household,url,False,lemon nice lightbulb
red vintage cork,household,url,True,red vintage cork
coral 5star lamp,household,url,True,coral 5star lamp
bronze latest painting,household,url,False,bronze latest painting
burgundy dull fryer,household,url,False,burgundy dull fryer
brick good flower,household,url,True,brick good flower
red latest lightbulb,household,url,False,red latest lightbulb
brick 5star plate,household,url,False,brick 5star plate
brown good barstool,household,url,False,brown good barstool
lime 5star smasher,household,url,False,lime 5star smasher
tin older strainer,household,url,True,tin older strainer
brown cool lamp,household,url,True,brown cool lamp
burgundy latest lighter,household,url,True,burgundy latest lighter
brown vintage rack,household,url,False,brown vintage rack
red great coffee,household,url,True,red great coffee
lemon best desk,household,url,True,lemon best desk
magenta vintage charger,household,url,False,magenta vintage charger
grey best ladle,household,url,False,grey best ladle
gold latest cup,household,url,True,gold latest cup
tin older fryer,household,url,True,tin older fryer
teal cool rack,household,url,True,teal cool rack
green great oven,household,url,False,green great oven
khaki latest couch,household,url,False,khaki latest couch
coral good footrest,household,url,False,coral good footrest
silver matte mixer,household,url,True,silver matte mixer
white quality oven,household,url,False,white quality oven
yellow cool smasher,household,url,False,yellow cool smasher
green latest barstool,household,url,False,green latest barstool
grass latest sectional,household,url,False,grass latest sectional
lime shiny bookshelf,household,url,False,lime shiny bookshelf
grass great sofa,household,url,False,grass great sofa
bronze cool cup,household,url,False,bronze cool cup
