indigo shiny Winnie-the-Pooh book,214,4,1976-04-24 11:31:49,71,35,cloudy and thrashed and low-calorie and tangential
grass best The Magic World book,165,3,2007-09-19 13:34:56,19,73,tropical and likely and brick and astounding
grey best soap,75,5,1974-06-10 08:31:22,99,8,lamentable and obscure and monotonous and personable
brown 5star ladle,91,2,1977-03-26 21:28:53,19,18,weedy and stylish and sunny and depressed
lime latest mousepad,227,3,1978-03-27 22:32:27,95,10,geriatric and moody and compound and unhurried
red 5star camera,70,1,2010-04-15 12:32:26,16,33,well-made and eight and rascally and sarcastic
tan nice watch,253,4,1984-03-16 10:39:11,45,32,clever and standoffish and peerless and cooing
blush quality projector,280,2,2019-04-06 21:53:37,40,97,damaged and doleful and proper and eminent
teal nice flower,104,2,2002-08-06 22:08:07,84,45,secure and survivable and latent and modern
bronze nice jogger,202,1,1994-08-10 19:53:25,17,8,stuffed and conditional and hour-long and scant
tin older pill,259,5,2012-03-26 03:14:32,40,18,degraded and excessive and tyrannical and untraditional
black vintage The Story of Doctor Dolittle book,176,1,2004-11-23 05:18:47,96,61,necessary and beckoning and unbridled and thievish
brick matte keyboard,191,5,1984-09-05 19:32:32,8,46,light and civil and cheerless and inadequate
teal nice projector,265,1,2016-01-20 20:24:58,1,50,extension and systematic and removable and opposable
gold 5star yogamat,160,1,1993-05-02 10:22:34,49,63,powerful and waterproof and immodest and fuzzy
charcoal cool conditioner,39,1,1996-03-05 17:04:20,96,27,jubilant and drained and confirmed and groomed
khaki good fryer,236,2,2003-04-15 14:35:04,80,2,absorbed and stupendous and populous and full
violet matte cork,144,2,1976-06-03 01:29:35,62,12,unforgiving and winsome and nifty and blistering
grey 5star chinos,100,3,1998-04-10 19:17:52,39,54,fatigued and nerve-racking and unyielding and vacant
rust great The Queen of Air and Darkness book,90,3,2009-04-26 15:09:37,37,37,heroic and waterlogged and unopposed and exalted
teal quality endpiece,143,2,1979-05-29 12:09:11,92,63,liable and unrealized and operatic and syllogistic
magenta cool mattress,31,1,1975-09-07 15:54:16,81,33,tall and roomy and frequent and spry
beige matte ladle,104,2,2000-12-14 15:12:06,99,48,tepid and bashful and inapplicable and well-educated
bronze shiny Billy Bunter of Greyfriars School book,206,5,1979-03-03 14:29:04,22,43,obligatory and unique and wonted and blossoming
black quality smasher,34,1,2005-03-08 08:16:04,5,10,seventh and meticulous and slippery and miraculous
pink dull Winnie-the-Pooh book,66,5,2009-12-01 13:13:54,2,66,crippling and noticeable and stumbling and taboo
black older belt,103,5,1987-07-18 05:13:56,87,89,divisive and fatherly and mystified and alarmed
blue cool camisole,286,4,1980-02-13 22:44:35,16,48,instinctual and rapid and quickest and clearheaded
brown nice The Magic World book,192,4,1995-12-01 11:29:22,15,5,worrisome and single and resilient and dynamic
maroon dull case,23,4,2012-04-16 11:57:56,79,64,thundering and mini and polite and disappointing
lime vintage microwave,17,4,1993-08-05 12:25:20,26,13,loquacious and ritualistic and drenched and minimum
silver quality laptop,116,4,1982-01-03 05:50:56,51,86,wonted and queasy and ill-humored and deprived
khaki matte rack,41,2,2011-10-05 19:23:14,60,65,brazen and stackable and engrossing and finicky
khaki cool kettlebell,133,1,2008-06-16 19:17:40,61,93,enduring and relaxing and accurate and iron-fisted
brick great laptop,124,3,1979-05-28 15:40:02,7,15,hard-to-find and smashing and descriptive and doubtful
red latest shirt,5,1,2008-07-23 17:30:26,34,13,preferential and sprite and stuttering and ornate
teal matte dumbbell,193,2,1998-10-08 17:46:38,49,92,unaccountable and dire and presumable and artless
red vintage watch,252,2,2012-03-25 18:09:24,25,5,arduous and incorrect and consoling and dependable
salmon great pomade,164,5,1970-01-22 22:48:28,18,49,medium-rare and chubby and immobile and oral
indigo shiny gel,112,1,2004-06-02 12:53:09,90,94,numberless and nutritional and dissonant and brief
teal good laptop,239,4,2000-08-09 11:59:51,85,6,wistful and sky-blue and yearning and taunting
silver vintage belt,5,3,2020-07-12 06:56:41,47,30,unmarketable and computer and managerial and crabby
lilac 5star computer,25,3,2014-05-13 19:50:26,35,61,stock and adhesive and offbeat and peevish
silver vintage mitts,222,3,2014-07-22 14:32:41,84,83,sensual and unplanned and intestinal and unanswerable
gold latest jacket,188,2,2001-03-19 08:47:07,71,96,vicarious and immodest and regional and melodic
blue shiny longsleeveshirt,236,2,1977-12-12 20:42:33,77,50,wavering and catatonic and tactful and talkative
black shiny The Hobbit book,70,1,2001-08-12 07:32:28,10,19,groaning and unintelligible and jovial and fitting
maroon vintage dumbbell,184,3,1979-06-25 20:45:10,2,9,doubting and ugly and strongest and voluptuous
magenta matte The Story of the Amulet book,62,4,2000-09-24 13:07:36,11,53,stunning and exaggerated and trick and miniature
silver matte suit,78,2,2006-02-04 07:36:54,77,87,infuriating and creepy and hyperbolic and swift
white quality knife,248,2,2006-12-04 19:18:18,91,24,outermost and international and offensive and praiseworthy
gold latest jacket,49,5,1974-08-19 10:34:06,45,58,undisciplined and refreshing and reputed and terrestrial
grass cool shampoo,275,3,1991-12-21 23:52:14,33,9,these and vague and unavailing and inviting
violet great dress,93,3,1998-11-01 13:23:44,8,36,worldly and masterful and breathtaking and indiscreet
blue great The Little Lost Hen book,225,2,1986-05-04 01:53:47,85,70,monumental and untapped and unemployed and entertaining
rose nice bar,53,2,1993-01-09 02:28:18,72,41,lonely and ear-splitting and caged and sugary
blush 5star dish,148,5,2011-09-14 17:55:46,19,5,reverse and crumbly and nonverbal and swimming
gold shiny hoody,75,2,2020-12-03 09:52:14,51,68,pronounced and fitting and unwitting and richest
silver quality gel,268,2,1993-12-15 02:06:32,72,19,satisfying and imperialistic and concerted and clashing
pink good floss,225,1,1991-04-16 03:30:02,24,89,unaggressive and compelling and unfocused and shocked
charcoal nice soundstation,74,4,1999-05-07 07:44:02,43,45,house and nonrenewable and striped and serendipitous
indigo vintage raincoat,222,2,1990-01-05 23:01:12,83,72,impenetrable and whimsical and self-centered and democratic
yellow older harddrive,282,1,1988-08-26 05:31:15,63,47,bloated and forensic and unsupervised and milky
gold 5star jorts,26,1,2011-06-15 14:36:27,37,52,telekinetic and dissolvable and ill-humored and front
cream shiny whisk,186,2,2000-02-15 16:50:35,10,89,monotonous and disingenuous and muddy and enchanted
tin 5star mousse,124,2,2005-09-06 20:38:17,23,54,wonderful and congruous and suspicious and discontented
blush shiny hulahoop,93,3,1991-05-17 22:22:31,74,49,diversified and hissing and preferable and luminescent
orange best buttonup,167,4,1980-03-27 22:17:55,85,9,verified and oppressive and striking and vertical
brown matte The Tale of Mrs. Tiggy-Winkle book,162,4,2002-04-28 12:02:25,65,91,scholarly and evocative and skilled and effervescent
teal cool candle,299,4,1986-11-27 20:17:31,78,27,efficient and detestable and unwieldy and uninsurable
purple matte mat,298,1,2011-11-18 10:47:10,14,87,satisfied and comical and changing and tenderhearted
brick cool jacket,257,3,2020-07-23 17:26:43,16,3,senior and neglectful and inescapable and fanatical
blue 5star Swallows and Amazons book,3,3,1992-09-05 10:03:04,97,72,incorrect and profane and jaded and incremental
magenta cool bowl,271,5,1987-09-12 01:43:52,70,53,vagrant and violent and pretend and evenhanded
khaki older floss,52,3,1978-02-26 07:41:01,25,26,disgraceful and splattered and different and correctable
salmon 5star desktop,59,4,1992-07-22 10:27:47,46,20,saddened and humongous and selective and clogged
silver cool rack,125,2,2013-12-09 03:19:44,48,5,insensible and low-fat and poorest and tenable
lilac vintage jorts,180,4,1979-02-11 01:18:22,51,99,snoring and utopian and flattered and wizardly
lilac cool yogamat,170,1,1975-06-27 03:27:38,29,48,rotating and exploding and frantic and containable
brick best hairspray,16,3,2017-11-20 19:48:11,23,23,fulfilling and uncritical and acclaimed and spotty
brick quality Dimsie Goes To School book,91,3,2006-02-27 11:08:48,7,30,sordid and assignable and collaborative and drab
rose good stool,141,2,2007-04-14 05:20:52,93,30,criminal and unappealing and erratic and demonic
teal older soap,62,4,2015-09-18 02:31:27,33,65,intimidating and beefy and tasteful and ethnic
oatmeal good chair,14,2,2001-07-12 19:41:27,30,17,endurable and devious and occupied and objective
bronze vintage Swallows and Amazons series book,95,2,1977-04-23 20:10:25,64,32,muttering and uncreative and nonverbal and connective
burgundy dull The Tale of Tom Kitten book,105,2,1993-06-29 09:39:05,76,24,slanted and racial and dark and bribable
white latest watch,249,3,1994-06-09 17:32:40,3,52,slick and unanswerable and psychosomatic and unattainable
bronze great oven,123,1,2001-10-23 12:44:05,30,54,elite and rotund and unannounced and masterful
grass matte dress,35,2,1976-02-13 11:50:56,19,65,brutish and funniest and degraded and monetary
cream 5star Dimsie Goes To School book,152,2,2021-10-24 08:53:07,60,38,legendary and secure and clownish and self-effacing
beige vintage The Tailor of Gloucester book,142,1,1970-09-19 19:58:05,19,84,indirect and rocketing and decorative and atrocious
rose older blazer,178,4,1983-11-03 14:58:35,25,40,bungling and stronger and soulful and routine
pink dull strainer,62,2,1986-12-24 12:19:40,86,44,brassy and approaching and unfriendly and intuitive
silver nice conditioner,49,1,2011-01-27 10:04:39,17,32,flattened and unavailable and underdeveloped and corrupting
gold latest mouse,155,2,1997-07-01 16:35:21,46,46,resounding and intended and numberless and cheery
silver shiny soundbox,105,3,2002-10-08 08:32:12,73,12,patient and ingratiating and unthinking and crass
oatmeal quality boombox,93,4,2003-12-09 18:55:37,94,35,pragmatic and prying and weakened and horrible
lilac matte case,239,4,1998-05-01 01:49:21,76,38,snippy and irresistible and unjust and flattered
blue nice crewneck,182,4,2008-11-02 17:42:29,65,56,richest and cackling and reddish and dogged
magenta cool The Camels Are Coming book,168,5,1983-08-29 18:30:25,40,1,inquisitive and sane and day and wax
salmon vintage shirt,19,5,1986-04-06 15:05:59,72,46,tardy and unseasonable and graceful and extendable
maroon nice hulahoop,235,4,1996-06-17 08:45:47,3,35,futuristic and awake and courageous and unfeeling
brown great grinder,41,2,2018-08-26 05:21:27,66,77,game and steamy and despairing and opposable
cream shiny cup,292,1,1999-06-13 14:34:37,36,33,bribable and sharpened and firm and moldy
magenta cool The Camels Are Coming book,121,5,1978-10-24 02:31:38,63,81,direct and unhesitating and tiresome and winsome
red shiny footrest,149,2,2016-08-04 02:01:31,68,63,rational and empirical and well-meaning and fierce
purple cool mouse,161,4,1983-07-20 19:37:30,83,37,blessed and expressive and agitated and exasperated
magenta nice The Tale of Squirrel Nutkin book,103,4,1998-02-19 01:08:14,54,12,subterranean and occupied and spatial and viable
lilac vintage laptop,152,2,1971-05-21 19:05:26,11,66,captive and stacked and competitive and retired
brown latest The Once and Future King book,20,3,1995-01-23 22:38:17,99,70,exotic and electrical and final and formal
purple vintage The Lord of the Rings book,8,2,2018-05-20 18:34:02,39,80,lying and flaky and nontransferable and harried
burgundy latest socks,240,3,1999-08-27 01:26:50,16,36,measurable and wood and swishing and reverent
coral latest socks,95,4,1979-07-26 10:05:13,78,21,experimental and extravagant and putrid and chuckling
pink 5star coffee,11,2,2016-08-13 03:11:33,2,38,talkative and insensitive and flamboyant and amused
green dull harddrive,280,2,2003-01-21 15:49:14,56,17,mathematical and burnable and grimacing and linear
brick quality Dimsie Goes To School book,289,3,1982-01-27 13:27:30,97,73,knotty and cleanable and mountainous and decentralized
lemon cool dongle,128,2,1986-03-08 17:48:36,5,70,unimpeded and steel and meditative and serviceable
bronze nice vase,144,2,1987-10-13 12:59:55,67,36,brutal and lumpy and tangy and poised
cream good flower,12,4,1974-02-06 20:49:28,95,81,fatal and thorough and fragile and ill-fated
red cool The Sword in the Stone book,134,5,1998-05-26 14:22:14,54,54,indispensable and decisive and submissive and unimpressive
red good jeans,257,5,1979-12-18 22:51:59,27,93,collegial and subtitled and abhorrent and nifty
gold great supplement,235,5,2008-12-23 22:20:07,2,40,undeterred and fainthearted and southern and unfair
magenta best The Two Towers book,282,3,2009-05-04 04:37:05,30,51,erroneous and unguarded and isolated and unreasonable
grass best protector,218,1,2017-09-15 20:57:47,48,17,potential and enduring and minor and chief
grey dull pill,49,2,1989-08-17 08:19:10,14,81,outrageous and bite-sized and utter and inopportune
blush 5star dish,27,1,2001-06-19 09:45:01,56,23,coy and insensitive and side-splitting and such
gold nice pill,282,2,1994-03-15 05:38:15,71,48,maladjusted and uncovered and chunky and overt
pink 5star crewneck,183,5,2007-04-21 21:53:49,4,46,unscrupulous and maximum and tame and grumbling
salmon best jeans,2,1,1988-01-04 18:25:41,31,23,steaming and earnest and well-adjusted and life
violet best countertop,76,2,2006-11-20 09:57:59,67,3,fuming and unmitigated and additional and truthful
bronze matte moisturizer,57,2,2021-09-17 06:06:40,86,6,inglorious and intimate and artless and floppy
green 5star dress,162,1,2001-05-18 12:55:58,84,87,ornery and tickling and prize and tough
maroon cool shoes,108,3,2011-10-24 01:40:26,51,62,encouraging and twinkling and momentous and chattering
tan good ties,105,1,1999-08-28 05:07:32,80,86,shrewd and unable and caustic and soft
rust nice spoon,135,3,2008-05-10 06:09:44,60,33,adequate and pale and considerate and well-balanced
salmon vintage watch,107,5,1981-12-03 04:03:21,62,24,resident and disputed and unfilled and uninvited
rose dull booties,69,2,1979-07-13 23:57:29,89,40,spongy and cockamamie and reverential and exquisite
blue matte protector,69,5,2015-05-20 17:27:13,49,10,continuous and rainy and beckoning and traitorous
lilac shiny shirt,116,2,2002-10-11 01:34:49,56,3,unadventurous and greedy and aware and concealed
"green dull ""The Little Bookroom book",87,1,2017-02-11 04:23:35,90,3,amusing and raging and glib and splintered
purple 5star toaster,217,2,1983-04-14 11:29:36,20,82,noncompetitive and incredible and pettish and concealable
white good shoes,289,4,1993-01-09 21:49:16,92,55,hairless and inscrutable and perpetual and furtive
khaki nice tanktop,239,5,2021-04-02 10:49:53,32,22,beefy and shrieking and payable and vertical
grass vintage boombox,59,2,1979-06-26 10:28:03,41,1,definable and dingy and take-charge and vexed
brown great grinder,287,3,1998-08-07 20:42:21,95,89,giant and lush and stinky and forgettable
tin quality desktop,293,2,2009-10-27 22:28:31,86,17,fawning and dedicated and stiff and notable
purple shiny endpiece,168,1,1972-04-29 05:18:36,74,71,attentive and flat and mythical and lanky
grass dull chair,156,4,1996-10-14 12:15:53,15,2,ancient and opposing and flamboyant and important
violet dull protector,249,1,1999-02-19 20:04:07,69,5,organizational and drooping and well-behaved and illuminating
blush latest cup,276,1,2015-02-05 22:15:43,96,31,mangy and desirable and shabby and acid
purple shiny table,66,5,2005-06-25 13:30:13,69,81,congruent and disapproving and indelible and unbeaten
gold great boots,26,2,1991-03-01 22:04:33,13,31,soldierly and theoretical and direful and rapid-fire
white nice The Railway Children book,214,1,1991-10-29 12:10:18,69,35,explicit and well-educated and tribal and variable
lemon quality dress,247,4,1995-08-04 07:56:07,31,8,swishing and insulting and itchy and psychedelic
teal shiny dumbbell,287,4,1974-01-03 04:17:59,49,62,unreasonable and indirect and scenic and enchanted
black vintage mask,273,4,1992-11-08 20:09:43,63,5,stanch and unnerved and baffled and decent
yellow shiny protector,249,1,1995-08-19 12:46:03,89,34,grueling and pathetic and throbbing and awakening
grass nice Old Peter's Russian Tales book,177,4,1990-02-21 22:39:47,4,48,compliant and flaming and unique and documentary
khaki cool lithium,160,2,2004-12-15 09:28:59,74,8,exterior and adaptable and fiscal and fathomable
khaki cool slippers,177,5,2007-11-18 21:01:14,19,51,spurious and customary and skilled and confused
white nice Winnie-the-Pooh book,129,4,1999-06-01 19:37:07,3,13,cute and loveable and baby and strident
yellow older coffee,214,2,1992-02-07 13:09:08,72,82,gracious and battered and urgent and boundless
teal nice projector,275,2,1978-01-13 19:43:07,66,72,splashy and milky and tight and direful
blush quality moisturizer,296,2,1996-08-22 21:02:31,61,58,jerky and despairing and overpowering and earthshaking
rose good grinder,35,2,2016-02-07 17:38:09,89,15,foxy and tapered and equidistant and groomed
orange cool slippers,40,4,1993-09-08 06:53:58,54,5,tenacious and scandalous and toothy and mangy
burgundy good microwave,21,4,2013-06-16 13:48:08,38,18,interdependent and stereotypical and nominal and flaky
lime cool table,221,3,2005-03-20 01:17:22,36,48,intricate and flavored and intolerable and petty
yellow older coffee,203,4,1990-03-13 01:22:26,81,91,consumable and enamored and poorer and eloquent
lime best knife,91,5,1984-06-23 05:33:36,91,4,particular and dress and biting and instant
gold older raincoat,45,4,1988-01-11 15:30:23,13,93,unrecognized and lawless and fidgeting and unbreakable
tan latest Swallowdale book,175,1,2008-08-13 11:15:59,62,7,doubtful and refundable and hotheaded and tremulous
yellow great mousse,80,2,1993-01-09 09:04:07,44,51,rampageous and beautiful and waspish and enraged
cream great tablet,153,4,1995-11-11 12:46:13,56,84,widespread and untidy and spectacular and paternalistic
"gold 5star ""The Little Bookroom book",16,1,2007-06-06 08:45:32,53,52,idiosyncratic and unrealized and sullen and uncharted
rose latest The Hobbit book,260,1,2013-04-20 09:36:02,99,76,guarded and adventurous and legislative and ready
maroon matte cord,214,1,1989-09-17 03:32:11,35,47,snuggly and quick-tempered and unlawful and identical
silver cool router,173,4,2013-01-24 14:30:41,74,72,wobbly and woeful and transparent and uninjured
indigo great laptop,159,4,1994-01-24 04:12:33,3,59,decorous and international and obsessive and momentary
indigo best belt,42,4,1978-08-15 22:08:47,9,84,silver-tongued and selected and approximate and unguarded
silver matte suit,15,4,1977-02-11 23:26:19,55,58,unsuccessful and sizzling and fortuitous and folded
salmon older jogger,71,2,1987-12-22 05:17:29,23,92,dependable and transplanted and slow and stinking
teal shiny Biggles Flies East book,267,3,1976-05-03 02:27:03,76,25,male and melodic and soakingwet and hard
green latest phone,14,3,1985-01-26 17:31:04,16,61,decent and pretty and jazzy and architectural
brown good keyboard,116,1,1983-05-12 03:54:04,82,88,grainy and glowing and artificial and enticing
lemon vintage television,82,2,2000-03-08 08:22:46,29,40,absorbed and unadventurous and small-minded and serious
green dull harddrive,242,1,2012-09-20 03:08:22,15,97,committed and alterable and such and smudged
gold cool raincoat,104,4,1983-06-10 10:06:23,37,9,mythical and formulaic and maternal and squeamish
coral quality bag,285,4,2016-02-07 21:19:27,53,94,fervent and eruptive and irrepressible and decorative
coral 5star The Fellowship of the Ring book,211,1,1980-06-12 10:38:13,9,51,audacious and sickening and unheated and searching
maroon cool candle,251,1,1976-05-21 21:50:35,79,43,fruity and stereophonic and psychosomatic and chance
brown cool kettlebell,21,5,1971-04-25 20:20:06,43,17,stackable and elusive and ponderous and dreadful
teal shiny headset,207,3,1987-02-14 07:11:58,10,75,unsatisfactory and darkened and solicitous and desirable
maroon matte Peter Pan in Kensington Gardens book,153,5,1995-11-09 18:26:21,1,95,gratuitous	.grave and lost and saucy and concurrent
rust dull The Phoenix and the Carpet book,203,1,2008-09-07 19:21:19,83,32,pervasive and contextual and mystifying and strong
orange cool pill,118,1,1970-04-25 06:08:53,5,75,distraught and tasteful and regretful and bohemian
magenta vintage raincoat,215,1,1991-04-09 06:32:22,86,62,communal and puzzling and lonely and richest
blush cool volumizer,203,3,2000-05-04 02:36:30,44,77,loathsome and halfhearted and verbal and teeny
brown shiny mask,269,5,2004-09-06 16:38:33,9,26,small-scale and caged and communicative and sparkly
gold 5star yogamat,244,5,1982-10-27 12:41:12,94,75,swinish and outward and miniature and chunky
khaki shiny dishwasher,164,3,2011-03-16 03:52:22,78,47,extra-small and boiling and bewitched and highfalutin
teal 5star projector,118,5,1998-12-17 01:49:58,7,73,avian and heinous and clinging and cumulative
tin great dress,293,2,1997-06-13 02:49:03,55,85,third and reusable and dawdling and inclusive
silver older shorts,219,5,1991-02-18 05:32:35,61,87,digital and sassy and modern and lukewarm
rose older dress,163,3,1983-02-22 02:51:09,58,50,unadorned and sickening and belching and frustrated
rose 5star Dimsie Moves Up book,151,2,2018-03-26 17:38:26,64,57,heartbreaking and side-splitting and ruddy and clamoring
tin quality desktop,262,1,1987-08-24 12:12:34,81,71,parking and medical and slight and indispensable
green cool mousepad,264,2,1996-07-22 09:47:46,91,51,unexplored and boorish and signed and carsick
lilac vintage laptop,79,1,2005-07-23 11:25:52,16,54,lasting and openhanded and infamous and longest
brick vintage tablet,142,2,1994-03-11 15:02:44,9,90,prudential and well-built and hormonal and maternal
beige nice kettlebell,93,1,2011-07-25 02:03:40,5,36,fried and uncoordinated and tangible and defendable
coral dull Biggles Flies East book,277,4,1992-10-28 09:37:51,61,94,futuristic and reminiscent and unobtainable and eternal
yellow nice lotion,72,1,1973-11-12 20:36:21,11,25,hyperirritable and vacuous and joyous and plaid
bronze dull The Candle in the Wind book,149,2,1987-05-10 15:48:59,13,48,lazy and creaking and rainy and ominous
tin matte television,137,2,2006-07-19 19:10:54,99,82,correctable and uneven and angular and creaky
grey latest Biggles Flies East book,273,4,1976-08-09 22:56:33,29,60,bright-eyed and valid and phosphorescent and frank
blush latest cup,175,1,2015-11-20 23:03:40,7,20,antsy and forgivable and ordinary and inhibited
cream nice belt,182,1,2008-10-29 04:34:45,31,86,flushed and unchangeable and kindly and ugly
tin 5star router,163,2,1984-12-23 21:01:16,49,16,alluring and descriptive and available and chewable
grey nice The Magic World book,103,3,1987-07-25 03:49:36,22,19,unauthorized and tanned and mischievous and pitiless
brown shiny bag,298,1,2008-05-14 01:49:51,11,26,unsustainable and bewitched and crotchety and plain
cream quality watch,293,1,2021-11-13 09:24:34,56,62,triangular and unmentionable and yawning and boorish
pink dull harddrive,107,3,2005-09-03 10:37:37,55,84,incurable and hoggish and aristocratic and immoral
khaki quality volumizer,103,2,1994-09-24 20:42:46,62,48,glowing and scathing and brick and abrupt
black matte bedframe,150,4,1979-01-25 18:22:30,69,18,prickly and stark and smoggy and self-directed
tin great The Little Grey Men book,207,4,1998-09-19 08:50:21,28,55,crazy and feathery and entire and ingratiating
brick matte keyboard,105,5,2020-05-12 09:39:07,93,69,indiscriminate and malevolent and connective and hard
indigo dull soundbox,267,5,2009-07-24 06:36:59,47,80,secret and superior and their and penetrating
khaki older hulahoop,109,1,1989-02-20 15:46:17,86,26,ratty and mountain and unsurprising and mystifying
maroon quality tanktop,295,2,1979-02-28 16:55:18,28,34,soulful and cute and surprised and patterned
violet dull protector,111,5,2004-12-09 02:22:38,18,6,unfulfilled and incongruent and imaginative and statuesque
rust dull The Phoenix and the Carpet book,154,5,1973-08-10 13:55:06,9,81,perky and meditative and latter and officious
violet best foambloack,106,2,1978-03-03 12:34:57,100,62,unbreakable and hardworking and navy-blue and gurgling
grey older flosser,129,3,1986-08-21 08:05:25,85,56,thrashed and colorful and quantitative and batty
red great The Lost Prince book,15,4,2016-01-23 17:05:18,52,13,clapping and cylindrical and discontented and generative
grey older shorts,193,5,1980-10-01 19:27:20,77,16,cordial and utter and adroit and late
indigo shiny Winnie-the-Pooh book,273,2,2012-04-12 18:15:20,8,28,difficult and inescapable and morose and magical
indigo shiny Winnie-the-Pooh book,245,1,1979-04-05 23:43:07,22,18,street and palatable and deluded and stuffed
indigo great toothbrush,246,4,1989-10-12 13:14:27,95,56,torturous and spineless and fast and fragile
pink vintage glass,199,2,2010-07-23 04:30:55,96,75,likely and watery and uncontainable and gainful
blush quality The Return of the King book,296,5,2006-09-07 18:22:44,65,2,inoffensive and majestic and dovish and wily
silver cool router,147,4,2012-11-08 08:47:25,94,94,feudal and tipsy and hoggish and lawful
indigo matte boombox,142,5,1977-02-09 20:15:59,42,8,decipherable and toneless and assured and kitchen
khaki good The Queen of Air and Darkness book,98,1,2002-10-16 03:50:11,88,58,fluent and undifferentiated and soulless and meager
rose great sieve,109,5,1970-02-03 23:05:24,8,59,unseasonable and mournful and unsympathetic and exasperated
teal nice harddrive,126,2,1972-07-13 10:28:56,83,37,hissing and fast-moving and syllabic and breezy
purple quality mask,142,2,2001-01-09 19:57:42,60,6,quotable and light-blue and unimpeachable and transcendent
