31,109,5,1991-08-18 16:16:17,67,65,horrible and extensive and unjust and distressing
81,42,1,1975-08-03 18:42:38,83,90,skimpy and musky and untamable and pretentious
42,83,1,2000-05-06 12:27:50,3,7,honorable and legitimate and extra-small and unable
47,176,5,1975-07-16 03:48:02,92,66,stacked and learned and corresponding and incredulous
17,84,3,1982-01-02 11:31:08,46,65,stranded and fourth and bighearted and unmatched
101,43,2,1971-07-05 01:38:55,37,47,estimated and silver-tongued and hour-long and assignable
115,72,4,2020-07-07 13:21:49,87,30,indispensable and nifty and distasteful and scrawny
13,191,3,1989-10-15 09:19:42,9,90,heartbreaking and unavailable and elastic and obese
45,57,4,1999-04-03 19:29:07,45,53,effusive and wacky and crossed and reserved
12,28,1,2018-04-25 01:38:40,72,25,dreadful and inquisitive and morose and incomprehensible
163,6,2,1991-05-08 03:09:18,63,98,pretentious and low-fat and awkward and fashionable
117,100,5,2010-02-25 08:49:37,21,73,usable and outraged and consenting and infatuated
132,161,3,1983-04-16 20:57:03,77,66,master and vital and sick and unreasonable
90,158,4,1970-07-18 02:43:55,89,30,polyunsaturated and muted and extemporaneous and disingenuous
198,157,1,1998-05-17 21:56:39,18,58,luscious and incongruous and vertical and illuminating
34,41,1,1989-08-01 08:34:01,22,55,overpriced and degraded and mistrustful and adept
36,102,2,2003-02-15 03:11:19,22,8,tough and golden and defective and dependable
138,168,4,1989-12-11 06:58:32,49,99,soulful and devious and smooth and jumbled
118,87,3,2013-08-22 05:02:28,66,49,dejected and lesser and prototypical and factual
126,191,5,2008-02-07 20:07:15,82,84,inopportune and odd and revealing and dreaded
8,110,3,2021-10-17 23:56:13,51,95,observable and negative and linguistic and rhetorical
90,55,5,1981-10-22 07:44:38,17,84,scornful and confusing and workable and bantering
129,106,1,1997-03-03 02:51:18,93,2,cheerless and outermost and concerned and joyous
140,125,1,2000-02-24 19:24:01,61,35,replicable and nontransferable and indulgent and unincorporated
59,7,4,2013-01-02 10:44:48,74,56,tearing and keen and incredulous and untrustworthy
163,15,4,1974-12-28 07:01:43,14,18,admiring and wondrous and vocal and candid
36,53,5,2021-03-07 06:45:17,69,67,programmable and purple and party and serial
150,155,2,1990-03-11 15:51:41,31,63,usual and aristocratic and well-aware and abandoned
99,98,2,2016-10-27 09:42:54,51,56,"inexhaustible and insistent and few, and unusual"
125,160,5,1976-08-21 23:28:30,12,83,magnificent and rhetorical and shoddy and unpleasant
14,188,5,2021-10-19 17:43:15,37,13,domestic and gushing and well-worn and well
182,67,3,1980-06-21 18:54:53,7,18,doting and external and beneficial and quick-acting
132,185,2,1971-02-07 11:09:53,73,11,ingenuous and elaborate and combative and mature
96,138,1,1989-10-01 08:10:32,94,70,craggy and volatile and insufficient and tearing
199,166,4,1981-02-28 09:46:48,73,86,momentary and medical and creeping and repeated
138,135,4,1998-12-04 21:09:51,89,25,restrictive and just and hurried and guiltless
80,50,1,1977-04-06 09:04:06,4,89,indefensible and consecutive and obtuse and shaded
63,169,2,2020-02-17 02:05:04,99,46,shrieking and oblique and undeterred and snappy
195,13,3,2019-12-23 15:28:14,59,61,corner and collapsed and largest and autonomous
180,37,1,1998-10-03 12:41:35,99,23,uninhibited and indeterminable and unconscionable and uninitiated
55,141,2,2014-09-25 09:22:52,17,97,vicarious and modified and finite and cooked
158,197,2,1975-08-10 03:37:49,57,52,bubbly and accidental and phonetic and floating
42,63,3,1985-08-12 23:17:46,46,85,biased and upset and relentless and quick-witted
48,187,3,2015-11-05 23:49:14,68,9,unconcerned and cooked and garish and meaningless
23,68,1,2015-10-25 12:26:44,18,93,actual and faithful and affectionate and scribbled
194,126,4,2004-08-19 04:09:20,9,34,deformed and like-minded and eye-popping and spirited
39,46,1,1989-11-25 19:07:25,72,25,mortified and disproved and unimpressive and dangerous
100,55,1,1978-03-28 21:12:29,19,36,outspoken and coy and ruinous and swinish
84,102,4,2003-01-11 02:50:22,95,64,serene and rhythmic and operatic and concealed
137,67,2,2003-04-04 20:38:36,99,100,smoky and facetious and slanderous and crooked
194,142,1,1978-01-03 23:56:43,76,93,fitting and misty and ornery and second-hand
162,127,1,2006-09-25 20:36:32,2,95,scriptural and ageless and ungenerous and priceless
120,151,5,2006-04-28 22:49:49,92,52,fastest and dress and shrewd and scrupulous
130,122,2,2014-12-13 04:56:14,28,20,flavorless and seditious and spiteful and trying
112,49,5,1982-11-28 16:34:33,44,56,dapper and meteoric and extravagant and wanting
149,95,4,2019-04-16 20:31:45,51,63,itty-bitty and sustainable and slushy and compound
169,59,2,2006-06-18 12:07:18,79,1,disloyal and infamous and high-functioning and untruthful
124,35,3,2012-08-03 16:42:53,13,83,pitch-dark and immanent and circular and watchful
132,134,1,1984-05-16 08:49:31,49,32,hurried and lucid and unstable and crucial
41,95,3,2004-04-08 08:55:19,72,83,padded and insincere and steady and shapeless
136,73,4,1974-08-28 20:02:41,36,59,zesty and creaky and annoying and cylindrical
145,50,1,2003-12-13 07:40:34,40,99,subdued and collapsing and mischievous and irreverent
144,68,4,1990-10-12 21:17:59,86,95,peaceful and mystifying and nauseous and bungling
8,124,5,2019-01-10 09:52:25,69,48,flushed and democratic and anticorrosive and horrid
91,181,1,2018-11-06 08:29:22,58,69,clinging and grinding and waspish and richer
27,76,4,1989-02-07 06:04:58,72,26,nearby and bantering and imperialistic and pedantic
85,175,1,1984-03-27 03:04:49,32,85,thumping and ruinous and unflattering and complex
144,53,2,1996-04-23 23:52:32,4,7,hospitable and unraveled and remarkable and late
43,52,2,2001-01-06 11:47:59,62,22,undeserved and weakened and interracial and bite-sized
89,173,3,1972-02-19 03:57:03,38,20,"minimum and permeable and forward and some,"
85,33,5,1984-05-11 03:13:22,28,40,green and unfocused and skilled and judgmental
190,117,1,1997-10-06 02:54:17,46,1,juvenile and unofficial and whimsical and cumbersome
0,130,3,2021-10-05 13:05:18,14,84,consenting and contemplative and pointless and hostile
70,145,3,2014-03-18 20:55:08,28,56,untenable and uncomfortable and homely and nasal
196,175,1,1991-01-23 20:03:49,63,47,crispy and displeasing and unimpeachable and depressing
1,192,2,2003-12-12 01:45:54,95,88,infected and stuck-up and possessive and blonde
1,75,3,2020-10-08 12:40:28,26,2,nosy and blamable and uncaring and catatonic
54,107,2,1989-09-10 15:37:26,18,89,pragmatic and plump and ungrateful and dogmatic
158,184,3,2003-05-10 10:47:41,14,55,grating and omnivorous and disappearing and plush
1,184,2,2015-02-25 19:45:41,56,34,self-indulgent and irregular and tyrannical and east
184,113,1,2012-11-01 23:06:32,58,69,shoddy and observant and unpleasant and disapproving
148,57,1,1978-06-05 19:01:06,80,46,semiprecious and pretentious and eloquent and work
47,103,5,1974-01-19 11:27:44,51,98,scruffy and colonial and near and basic
154,145,4,1996-10-03 17:28:40,28,89,steadfast and contemptible and unapologetic and only
151,106,4,2013-07-22 11:26:28,50,47,wacky and luxurious and refurbished and next
146,75,5,1971-11-16 04:29:53,55,77,prophetic and side-splitting and rotting and sufficient
57,104,1,1987-06-29 16:09:44,37,84,harebrained and rampageous and aware and gloomy
146,162,5,1984-10-25 18:33:03,94,36,briny and okay and efficacious and payable
186,43,4,2018-07-05 05:39:52,17,76,stirring and vivid and gaseous and larger
110,18,4,1997-02-17 14:38:21,80,58,front and timorous and industrious and civil
87,109,3,1970-02-06 10:06:01,23,66,fearful and ruined and extendable and unprecedented
10,46,2,2013-03-09 19:35:58,96,59,separate and exhaustive and feared and exalted
172,4,5,2019-06-10 04:01:40,14,3,putrid and bothered and bungling and nominal
103,87,4,1978-12-26 13:48:50,36,4,calculated and entrepreneurial and abysmal and classical
35,59,2,1996-01-28 04:08:19,80,21,fit and groaning and close and fraternal
41,121,2,1975-11-14 04:35:14,57,79,inferior and continuous and theological and glassy
107,176,5,1997-05-02 08:38:19,9,4,well-behaved and macho and capricious and intelligible
6,101,4,1973-02-24 07:48:52,67,37,short-tempered and electrical and ingenuous and immovable
92,137,3,2005-04-29 14:42:37,85,21,fastidious and contributive and simplistic and all-too-common
135,83,4,1980-10-09 12:55:21,34,80,informed and evasive and irrelative and plane
108,184,2,2001-08-16 23:18:10,13,56,timid and twinkling and alienated and unfaithful
132,63,5,1972-08-01 12:34:15,40,46,imponderable and individualistic and imperceptible and hefty
4,56,1,1998-09-13 02:27:42,72,18,cocky and redeemable and adored and steaming
172,51,2,1987-10-16 15:13:10,55,35,billowy and impassable and falsified and passionate
83,163,1,1978-01-03 12:19:49,50,41,preventive and dress and apologetic and cramped
199,116,2,2020-07-18 14:32:52,69,90,controllable and oily and substantial and fulfilled
111,68,4,1978-04-06 10:51:24,79,79,amazed and still and unrepresentative and venturesome
137,23,5,1984-01-28 11:12:13,67,64,well-dressed and inevitable and unhappy and fun
182,185,3,2020-12-22 14:57:22,15,10,unintelligent and oldest and gradual and clogged
69,122,2,2002-02-26 08:48:54,61,84,crumply and barefooted and well-equipped and empirical
50,114,2,1992-01-26 15:22:30,33,54,ultraconservative and retroactive and adequate and five
56,151,4,2003-10-18 07:05:10,38,55,unimaginable and good and temperamental and speedy
191,53,2,1985-05-28 04:49:58,11,62,republican and smooth and portable and unassailable
108,77,2,2014-08-07 03:31:34,58,43,unconstructive and individual and venturous and perilous
14,133,5,1998-08-29 21:56:59,97,83,proud and circling and swollen and oafish
43,57,1,2019-12-12 13:26:02,20,41,alleged and prophetic and sculpted and infuriated
8,146,2,1987-11-08 14:40:41,90,14,routine and capable and wicked and edgy
20,3,1,1997-01-21 10:13:06,61,38,background and supple and classy and proportionate
168,173,3,1986-03-14 23:25:09,83,33,wooing and solitary and frisky and overwhelming
38,147,2,1980-12-21 18:11:33,92,16,bighearted and befuddled and veritable and irreplaceable
67,170,2,1993-05-12 07:26:13,78,75,lighthearted and expansive and resounding and secret
161,83,2,1991-06-08 06:40:21,72,7,rotten and disaffected and quotable and younger
26,187,1,2004-01-07 09:13:57,21,43,concealable and oblong and invigorating and nutty
198,178,2,1972-06-22 10:24:54,67,59,tepid and stanch and slothful and balmy
48,24,2,1986-05-10 22:27:22,100,23,inhibited and enchanted and rippling and amused
18,58,1,1994-04-11 04:52:09,15,52,jobless and ill and jeering and defendable
12,75,1,2020-06-21 07:42:29,77,32,unashamed and inexact and translucent and sinful
59,145,3,1980-08-26 01:48:30,22,12,foamy and horrible and familiar and left-handed
197,187,1,1984-05-06 09:20:23,21,80,dizzying and mangy and distracted and imported
143,28,3,1996-01-06 09:50:52,88,96,presidential and welcoming and overjoyed and limp
130,34,3,2004-11-28 05:17:36,4,96,"prevalent and deceitful and maiden and many,"
197,195,2,2006-03-14 17:13:17,94,98,meditative and puffy and winsome and remarkable
111,105,4,1979-10-07 05:56:37,3,4,textual and libelous and soothed and amicable
178,99,5,2015-12-22 18:44:02,97,9,sociable and dizzy and weird and outgoing
93,48,1,1977-09-19 15:45:31,58,44,inane and inconsolable and scriptural and iconoclastic
173,79,4,2015-09-17 07:47:06,65,55,inherent and wide-ranging and short and survivable
62,197,1,1970-01-21 06:19:04,13,43,worn and unemotional and hot-shot and major
47,83,5,2012-10-21 07:09:05,94,49,combative and sore and victorious and fiendish
81,109,2,2015-08-16 19:19:20,92,36,gray and squeamish and closeable and aerial
118,197,5,1988-01-18 21:41:26,83,70,mushy and starving and irritable and unpromising
142,125,1,1978-07-11 09:29:56,75,28,lavish and touchy and horrified and ugly
65,92,4,2005-01-14 19:13:36,66,94,unwise and penetrating and simplistic and cropped
125,136,1,2008-01-04 13:03:23,37,42,eerie and helpful and lithographic and drenched
4,101,3,1976-03-11 04:59:39,92,1,warm and suffering and contradictory and teeny
167,133,1,1995-01-07 19:37:25,67,24,painful and hilarious and unseemly and imposing
190,88,5,2005-05-01 14:41:20,77,71,meaty and false and socialist and chivalrous
6,124,4,2020-02-09 01:50:30,95,76,perturbed and empirical and overconfident and virulent
199,107,5,2004-07-01 20:32:20,42,94,less-qualified and defensive and likable and defenseless
1,81,4,1985-11-04 12:23:42,25,2,breezy and future and high-risk and cantankerous
194,22,3,1997-10-18 03:12:31,80,40,red and undeserved and triangular and ritualistic
197,28,3,1971-07-05 15:51:55,51,17,lame and spiritual and resounding and intelligible
183,25,5,1971-10-25 20:51:44,100,100,slow-moving and statuesque and digestive and decorous
121,174,1,1999-05-17 02:21:44,91,44,tacit and exterior and unequaled and aggressive
20,161,4,2012-12-28 08:57:59,84,62,likable and gnarly and terse and irrelevant
199,79,5,1990-05-03 02:48:21,15,85,capable and plump and calm and definable
118,100,4,1979-10-17 22:05:37,98,41,"meteoric and hawkish and many, and dainty"
88,162,1,2008-10-28 09:31:10,96,89,ghoulish and listless and all and mocking
106,168,2,1983-07-11 23:30:23,33,76,waxen and bilingual and sea and this
96,33,4,1974-12-18 13:04:19,25,42,divine and trite and tiresome and huge
60,9,4,1980-02-26 01:03:54,63,73,smeared and speculative and good-looking and jerky
142,24,3,1993-08-25 04:39:03,10,17,weedy and well-developed and intrepid and unwary
92,25,4,2007-02-05 16:09:22,1,92,grieving and officious and imprecise and appealing
40,175,1,1983-05-20 14:05:47,59,85,entranced and similar and winsome and unchanging
10,128,2,2001-05-15 22:27:22,90,28,accused and shattering and needy and transformational
55,167,3,2020-09-17 16:13:03,47,76,underhanded and side-splitting and grubby and danceable
149,65,1,1985-10-01 16:24:40,7,38,adored and tense and ludicrous and away
109,47,3,1976-02-18 17:42:10,28,59,foul and mnemonic and uppity and decorous
48,147,4,1979-03-01 19:48:03,40,37,sequential and unilateral and collaborative and emotional
182,182,5,1995-09-06 02:57:49,4,86,worth and seasonable and decorative and symmetrical
93,5,1,1973-09-24 04:48:52,28,75,far and professorial and unappetizing and tropical
146,116,3,2003-07-03 19:13:05,23,42,resentful and unwitting and free and incontrovertible
39,193,2,1982-02-07 03:23:17,97,96,forgiving and unblushing and transitory and nauseous
80,42,3,1981-10-21 11:07:23,30,39,uniform and pallid and enchanting and guilty
191,184,3,2001-12-11 05:31:33,30,7,hygienic and ponderous and psychosomatic and trapped
99,55,1,2003-06-22 02:33:19,76,57,stinging and cross and ossified and complacent
51,167,1,1980-02-17 05:52:29,74,84,connected and disappointing and medicinal and stanch
54,136,2,1970-09-19 05:21:47,58,11,concerted and powerless and indiscriminate and inoperative
29,49,5,2002-01-05 06:40:37,23,42,mammoth and delirious and fast-moving and resident
111,75,3,2018-12-03 11:59:28,15,28,lucent and confident and nonverbal and blameless
96,6,5,2001-07-08 14:28:42,93,94,wounding and instinctive and oxymoronic and constant
166,94,3,2012-08-10 13:43:07,13,57,fast and matronly and sketchy and central
43,31,2,1992-01-10 18:28:27,66,91,snow-white and serial and rueful and symptomatic
62,82,4,2010-06-08 12:01:44,74,69,manicured and supple and virtual and enchanted
178,68,1,1976-11-02 22:39:42,88,93,lined and lucky and joint and supersensitive
192,77,5,2018-04-24 15:34:24,55,87,saddened and close-minded and self-assured and nonstop
58,187,2,1983-01-03 04:31:15,75,39,average and crazy and faulty and lax
14,26,3,2008-03-11 19:37:12,13,21,snobbish and chicken and beady and other
42,31,2,1983-04-09 19:24:54,12,26,dowdy and demanding and humiliated and pivotal
82,7,4,1980-08-14 12:29:41,85,2,watery and unconquerable and prissy and concise
97,85,4,1983-04-06 07:42:26,41,89,mincing and ultrasensitive and inadequate and richest
176,147,4,1970-09-20 18:21:22,84,59,recyclable and high-functioning and chubby and brash
55,199,3,2013-01-17 03:43:43,94,63,diverse and pallid and allusive and dignified
125,112,3,2003-01-28 13:01:23,45,32,beeping and metaphoric and forgetful and whispering
42,162,3,1996-10-24 15:52:47,64,85,obtrusive and perfect and deprived and treatable
112,42,3,2018-11-18 01:52:43,11,70,destroyed and venal and speechless and closed
36,185,2,1983-05-05 01:07:05,33,23,our and flabby and uninvited and lengthy
163,142,4,1975-03-11 14:18:11,77,76,chauvinistic and laborious and giggling and major
179,145,5,2020-06-16 06:56:02,30,64,snarling and week-long and mistrustful and uncouth
55,4,3,2019-09-25 09:49:41,69,55,dismissive and watchful and disreputable and antisocial
148,117,4,1976-07-15 08:47:56,19,13,blatant and attributable and scared and untrained
75,166,4,2004-07-28 11:06:56,78,81,top and spare and these and faithless
171,146,3,1994-07-04 19:23:27,95,100,righteous and hazardous and elite and five
117,144,3,2010-07-24 23:46:48,42,5,favorable and civil and ghoulish and reigning
95,53,1,1995-10-12 04:15:25,48,48,devastated and circular and adventurous and dress
50,35,1,2008-02-25 11:12:25,12,19,slanted and ungallant and unflinching and nostalgic
87,120,1,2005-04-01 15:54:52,62,98,cancelled and workable and foggy and extra-small
37,95,5,1991-09-25 14:45:34,7,53,decaying and shy and clearheaded and wearisome
177,111,1,2012-12-29 11:48:13,71,87,preferable and unintelligible and presentable and punctual
115,102,3,1971-12-16 11:12:41,22,44,tired and libelous and worrying and reassuring
15,147,5,1972-02-22 05:50:49,16,43,male and crystallized and shapely and impressionable
157,190,4,2001-04-04 01:17:25,41,3,exasperated and radioactive and disadvantaged and cultural
27,112,1,2010-03-23 10:36:59,12,45,prized and well-liked and acid and virulent
108,9,3,2008-11-05 02:21:51,32,98,unaided and peripheral and unbeatable and plastic
49,149,5,2016-11-04 18:03:12,29,71,mechanical and jittery and well-done and preoccupied
113,159,1,1995-10-04 09:30:10,94,72,likely and unashamed and reverent and dead
141,31,1,1990-09-14 23:55:45,50,66,cancerous and avant-garde and controllable and sappy
130,74,4,1986-05-09 03:56:37,17,47,defenseless and striking and lined and praiseworthy
26,98,4,1985-12-05 03:55:32,90,52,renegotiable and bureaucratic and mission and perverse
180,165,2,2012-09-26 11:01:08,33,83,grumbling and unintelligent and wondrous and dizzying
145,39,1,1998-07-26 09:54:32,72,72,snug and red and tiring and classified
12,22,4,2007-07-27 04:37:57,47,54,benevolent and dishonest and obvious and neurological
150,194,3,1994-02-04 02:55:24,24,51,steaming and crowded and calculated and additional
76,54,1,1977-10-16 10:40:56,79,41,rueful and torrential and jolly and satisfying
155,44,2,2017-08-08 01:51:07,72,90,barking and innocent and static and long-term
45,126,2,1984-10-08 05:30:42,19,77,incalculable and joyful and attributable and colorful
21,144,3,1989-02-14 20:26:32,14,2,doting and sleek and glorious and polished
162,173,4,1997-02-16 23:56:29,94,25,filthy and unrepresentative and smoky and elaborate
9,90,2,2001-07-07 22:51:28,91,17,dizzying and disciplined and shimmering and stormy
122,66,2,2013-09-16 21:24:25,77,60,consenting and younger and low-carb and princely
106,174,4,1977-08-22 20:53:14,9,35,perpetual and dispensable and intravenous and sheltered
40,90,1,1985-07-23 04:51:05,90,61,critical and diffuse and brief and unbreakable
173,154,3,2009-11-29 16:07:06,72,51,indiscriminate and passing and droll and bleached
84,192,2,2014-12-02 11:30:50,70,19,telephonic and second-hand and futile and complex
185,51,1,2016-05-28 17:51:51,7,71,prevalent and nominal and pitch-dark and uppity
157,140,3,2007-05-11 07:40:24,55,91,unnerved and deadpan and theological and sweeping
103,105,5,2010-09-03 14:21:17,97,5,quick-witted and nonconsecutive and obeisant and unassailable
68,99,5,2005-12-24 17:24:07,38,89,humorless and militaristic and direful and brazen
133,27,5,1980-09-08 03:02:15,57,3,peppery and controlling and ubiquitous and thoughtful
88,98,2,1990-04-27 02:26:32,19,32,deliberate and inexact and self-aggrandizing and alluring
184,80,2,2021-09-11 10:29:13,72,14,salty and suspicious and stale and purring
158,52,3,1970-05-22 12:18:20,36,75,mortified and high-functioning and illogical and understood
89,185,4,2018-08-04 12:49:51,17,79,prohibitive and ironic and exacting and spattered
187,6,5,1973-01-14 11:48:50,20,58,sufficient and succulent and excessive and semiprofessional
92,48,5,1996-08-21 20:51:42,33,42,present and hospitable and intelligible and atypical
130,55,2,1981-06-08 04:40:26,94,13,educated and expert and keen and unspoiled
132,94,3,2018-02-09 07:11:52,34,20,steely and uttermost and locked and crazy
162,81,1,2009-05-21 10:39:34,77,9,pampered and multifaceted and riveting and second
191,140,1,2003-11-08 21:08:58,42,49,unchanging and obliging and three and republican
19,82,3,1989-02-23 18:20:10,38,73,languishing and crawling and guilt-ridden and high-maintenance
25,186,3,1983-05-08 10:56:53,56,3,live and moral and humorless and lovable
15,8,5,1980-07-14 13:27:31,96,22,connected and royal and money-grubbing and palatial
68,123,5,1987-07-01 09:51:57,51,27,flimsy and disruptive and well-worn and blushing
165,81,4,1974-07-20 08:56:58,82,82,boring and criminal and unintelligent and vigorous
185,33,5,1975-10-05 01:55:27,27,56,inflatable and problematic and nonstop and closeable
119,10,3,1986-05-28 20:48:53,43,38,spectacular and sustainable and enticing and precious
30,40,1,1995-08-28 10:58:09,31,1,heroic and artless and antiseptic and sore
136,61,3,1996-05-25 13:48:09,91,61,inspirational and wrenching and largest and wonted
70,132,4,1987-10-08 04:47:13,48,38,thrifty and corrupting and insipid and stereotypical
166,9,5,2001-05-14 16:34:46,90,11,sublime and straggly and nine and unwieldy
98,122,5,2014-09-20 21:17:16,56,65,fiendish and devastated and pompous and excusable
199,175,1,1972-04-29 16:05:58,52,63,comical and low-fat and mumbled and jobless
156,164,2,1980-07-24 03:13:32,60,86,buzzing and eccentric and portable and appealing
173,118,2,1983-08-07 20:02:34,24,5,creeping and racial and general and integral
60,179,4,1980-03-09 21:52:33,26,40,arrogant and detectable and guaranteed and postoperative
24,11,4,2010-04-27 21:14:40,20,83,ill-fated and matted and insane and thematic
46,17,5,1977-11-15 06:02:30,33,76,inquiring and digressive and that and streaked
39,42,2,1975-03-28 02:26:51,91,59,unhurried and absentminded and worst and unreadable
154,184,4,1982-03-15 05:39:20,68,8,computerized and trite and enigmatic and moved
70,153,5,1988-06-08 18:01:09,85,24,anticlimactic and guarded and prejudicial and mistrusting
185,24,3,2019-03-29 08:53:51,57,67,present and improved and sloppy and frowning
99,78,5,1992-06-25 14:38:14,28,58,goofy and uncomprehending and meditative and mathematical
193,65,3,1980-11-04 20:29:14,12,51,prohibitive and prevalent and colonial and flying
29,64,2,1987-01-29 10:59:24,60,98,selective and joint and substantiated and warlike
132,127,4,2004-11-28 09:05:51,91,26,perpendicular and fried and invasive and stringent
67,157,3,1987-11-10 09:45:04,37,84,wornout and functional and threatening and flowery
163,25,3,1986-03-27 22:07:07,15,42,innovative and errant and scattered and unbiased
24,90,1,1979-09-24 11:26:30,27,74,dress and infamous and fetching and outrageous
47,133,5,1999-06-28 02:11:33,83,54,irremovable and enhanced and huggable and ridiculing
199,197,1,1994-12-25 18:05:33,6,20,skilled and worrying and mountain and indicative
24,123,1,2007-10-14 09:49:52,78,74,egalitarian and earthy and bumpy and scanty
181,32,4,1986-07-20 04:42:17,22,81,buoyant and strenuous and deformed and stuffy
85,3,2,2002-01-19 22:22:47,94,88,aware and gleaming and wary and euphemistic
128,72,4,2020-08-25 18:50:05,47,96,exhaustive and doubting and adamant and dismal
127,155,2,1974-06-29 18:40:41,37,64,those and rectifiable and reprehensible and unmarketable
11,109,3,1981-09-29 23:12:09,83,15,halting and primitive and illegal and unkempt
17,17,2,2001-06-09 11:33:22,23,99,stereotypical and unwatchable and pathetic and exquisite
68,31,5,2000-03-02 03:22:31,42,48,gabby and telekinetic and self-aggrandizing and theoretical
143,111,4,2008-04-28 04:26:25,39,37,devoted and exhaustive and wide and jagged
126,106,3,1995-09-10 10:48:50,19,62,inescapable and booming and deceivable and crackling
29,161,3,2016-12-20 10:29:05,53,97,wary and stony and litigious and spiraled
33,21,4,1998-06-23 16:39:20,28,95,rampant and justifiable and humongous and blameless
9,101,1,2005-10-09 08:49:58,50,40,autonomous and more and coquettish and tidal
48,142,5,1978-05-27 05:26:06,88,53,deep and inordinate and overcritical and sloping
115,29,2,1982-05-24 05:16:26,17,17,willing and untimely and palatial and glamorous
156,198,1,2003-02-09 01:03:23,59,26,regretful and tangible and therapeutic and silver-tongued
123,103,5,2020-03-06 18:38:41,27,100,stuffy and plush and incoherent and susceptible
16,121,2,2016-01-02 01:58:40,72,82,unworldly and attainable and weighty and sappy
117,8,5,2013-06-24 13:15:36,25,11,uncomprehending and impassioned and undiminished and direct
50,56,1,2009-03-10 14:56:40,60,91,reminiscent and angered and bewitched and green
9,150,5,2002-12-09 21:44:14,14,76,iron and unbalanced and brooding and his
193,14,4,2019-02-23 07:27:22,73,43,sedate and redolent and dried and salacious
102,190,3,1974-05-20 01:04:40,59,58,alarmed and salted and grey and precious
34,66,4,1988-05-29 17:39:25,29,27,intermittent and striking and bendable and streaked
36,83,5,1997-04-17 17:18:24,13,39,lifelong and monumental and well-suited and spinal
