164,179,2,1980-02-26 01:40:27,21,19,just and instant and introverted and sellable
154,24,5,1977-07-10 09:03:01,79,66,repeated and axiomatic and saccharin and skinny
162,112,1,1990-03-08 22:06:58,17,45,four and uncharitable and cute and peaceful
181,76,1,1991-06-16 03:37:18,54,73,unrelenting and compliant and supportive and compassionate
98,46,1,2000-02-14 04:53:58,22,95,muffled and unwashed and demented and decimated
177,94,4,1989-05-27 20:47:46,35,67,uncomprehending and organizational and impressive and regrettable
10,133,3,1995-12-14 01:15:13,45,33,dissuasive and venturesome and inconsiderate and operatic
199,82,3,1981-12-04 13:34:46,43,16,abounding and faithful and living and referential
32,36,3,1989-11-28 07:50:56,39,48,derivative and fanatical and manageable and resounding
158,135,1,1980-01-19 18:57:59,41,60,relaxed and bushy and chanting and conspiratorial
64,199,4,2017-01-29 04:03:27,75,93,tearing and degenerative and implausible and infectious
51,141,4,2021-11-13 02:11:35,37,3,civil and reserved and inapplicable and this
115,22,2,2014-11-01 22:24:04,6,2,treasonable and untitled and same and detailed
20,127,1,2020-10-28 06:06:03,36,70,volatile and disputable and opened and swanky
18,147,5,2018-05-09 21:55:51,14,72,comparative and wily and hectic and programmable
197,87,4,2011-06-15 15:37:22,37,41,infuriated and upper and liable and obedient
162,115,2,1970-03-12 23:33:36,3,10,ambulatory and jiggling and nippy and an
162,56,4,2016-08-14 22:13:55,64,5,gradual and creepy and retroactive and contemptuous
112,144,2,2014-11-13 14:14:42,11,21,unfriendly and moving and sappy and unmemorable
165,11,1,1994-09-21 09:40:41,71,43,unclassified and sneaky and overoptimistic and abusive
163,53,3,2004-12-24 19:11:44,71,34,premeditated and merciful and parenthetic and imminent
18,174,5,1982-02-06 10:58:50,84,70,erasable and bodacious and floral and its
68,5,5,2012-01-02 21:53:58,20,43,mistrustful and insensible and bantering and devoted
45,96,1,1979-12-12 07:42:43,37,85,foul and self-respect and expectant and wavering
92,86,3,2013-10-11 14:01:34,73,14,overpowering and far-flung and notorious and steadfast
10,7,2,2018-10-18 17:31:29,28,26,seasonal and guilty and wool and disobedient
13,123,2,2014-03-14 04:39:10,13,82,torpid and nonchalant and laughable and contextual
139,37,1,1987-05-21 10:27:02,11,19,early and half and pithy and yelping
134,78,3,1982-06-29 20:12:24,32,72,second-hand and recyclable and conflicting and murky
13,169,5,1984-06-23 07:02:47,67,16,coldhearted and nameless and divisive and submissive
108,94,4,1980-03-20 03:39:38,47,59,insulted and plane and astonishing and wondrous
160,196,5,1995-08-20 04:07:14,11,54,consensual and unscrupulous and addictive and tepid
54,110,3,1984-08-14 12:43:48,45,85,affectionate and coercive and accusative and nonaggressive
81,65,1,2014-11-15 07:43:12,9,80,classified and workable and exasperated and unrestrained
130,36,1,1995-08-26 12:17:52,65,26,untimely and technical and exponential and elegant
75,120,1,1975-02-15 17:48:41,77,76,even and willful and brave and dry
186,15,2,1991-01-22 08:47:23,7,19,bulky and staunch and indeterminate and cackling
99,162,3,2017-01-05 15:25:56,7,85,learnable and morose and stacked and mushy
88,129,5,1982-08-06 03:59:28,58,8,concise and abounding and dogged and supernatural
64,50,2,1979-06-27 01:37:01,35,85,deaf and oceanic and irregular and avant-garde
27,157,1,2017-06-20 06:02:02,81,39,real and rare and wandering and viral
127,123,1,2018-12-22 07:09:27,20,6,major and cryptic and corporate and emotional
84,25,1,1974-03-17 08:01:13,19,68,unscientific and harebrained and shapeless and raging
111,62,5,2021-05-27 15:39:49,70,92,divisive and immoral and acidic and inactive
14,104,1,1974-01-02 15:34:17,67,52,inconclusive and soaked and boorish and poorer
41,117,4,2005-08-03 06:12:32,81,67,mistrustful and coarse and undiminished and cosmic
28,44,5,2014-05-18 20:33:32,87,58,colorless and mocking and weakened and bilingual
126,153,5,2015-04-09 19:43:29,22,11,ambitious and bronzed and rueful and tidy
67,145,1,2006-04-10 02:35:23,43,14,tepid and undaunted and terrestrial and quick-witted
137,190,4,1987-08-20 18:51:25,24,11,calming and excessive and danceable and trim
103,199,5,2004-06-12 09:45:25,11,66,formless and cliquish and trapped and triumphant
18,183,3,2008-11-16 12:28:48,88,84,chronological and voiceless and evasive and disturbing
186,2,5,1983-11-25 12:09:28,65,40,double and nonrestrictive and fascinated and stressful
166,40,2,1973-10-11 10:47:16,72,22,actionable and lopsided and worrying and synonymous
83,75,5,2021-05-08 23:28:50,76,82,early and bustling and respective and gaunt
35,53,3,1970-07-28 22:31:12,82,46,unseasonable and contagious and responsive and dusty
81,17,4,1985-06-09 06:42:46,63,72,civilized and budget and direct and gigantic
179,163,5,1974-06-29 04:31:57,15,17,perceivable and unable and dwarfish and psychotic
40,198,3,2005-04-29 19:12:51,27,17,interracial and functional and unreadable and unblinking
168,192,5,2016-07-23 21:51:06,93,52,compulsory and decadent and superlative and insincere
79,19,3,1971-07-03 01:07:39,31,29,attributable and seamless and brown and enchanted
36,48,2,2005-11-05 03:11:56,92,81,commanding and abrupt and warm and stupendous
183,43,1,2011-03-14 03:22:09,21,77,insufficient and fuming and squatting and grey
194,115,1,2017-01-25 01:13:01,84,18,trusting and drooping and healthy and asymmetrical
82,94,5,2000-12-13 12:36:56,13,83,eligible and odious and pitch-perfect and unassailable
144,74,2,1989-03-22 23:37:26,11,21,transitory and sad and reverent and excellent
75,30,2,2014-10-15 13:14:16,65,49,famous and unwilling and grown-up and formless
126,168,1,1991-07-26 09:54:04,44,53,painful and pink and vehement and veritable
163,94,3,2005-08-04 21:39:50,18,51,spattered and commemorative and extended and confident
86,198,4,1976-02-13 12:50:09,66,37,esoteric and devastating and lateral and extraordinary
149,85,4,1979-01-03 17:05:26,49,26,spicy and irreverent and telescopic and boisterous
73,190,4,2000-03-03 20:59:31,72,71,protective and excitable and moldy and condensed
172,58,5,2015-11-04 23:41:14,52,41,vicious and slender and clandestine and melted
171,199,2,2020-11-24 12:23:31,2,3,painful and final and fraudulent and indefinable
39,186,3,1997-10-28 03:12:08,83,89,uncritical and rented and possible and economy
168,30,1,1999-07-05 17:41:38,48,23,villainous and purposeful and dispensable and coercive
49,2,2,1989-01-12 14:45:30,14,25,distracted and colorless and monotonous and exceptional
110,170,5,1992-06-24 22:30:15,29,95,striking and alienated and foul-smelling and resident
4,28,1,2008-05-28 09:11:34,94,10,historical and fragrant and cloistered and defeated
72,108,3,2000-06-07 21:44:30,33,27,deaf and delighted and damaged and triumphant
114,26,2,2008-12-07 02:36:29,7,43,seasick and sportsmanly and unredeemable and self-disciplined
199,45,2,1973-02-26 14:57:51,24,47,trivial and powerless and seismic and reckless
8,73,4,1980-02-26 09:49:43,92,74,low-carb and unquestionable and incurable and immanent
143,187,5,1978-02-22 19:10:59,76,43,laughing and insidious and stretchy and ill-equipped
127,185,5,1992-09-18 07:39:30,25,95,touchy and formulaic and sketchy and stock
93,18,5,2003-07-21 09:43:48,45,68,repentant and ratty and horrific and intolerable
13,80,1,1994-01-26 08:41:33,40,55,vindictive and hurt and crumbling and faraway
28,150,2,1985-01-15 02:22:50,44,16,inglorious and oceanic and distinguished and deafening
58,100,3,1971-01-10 10:33:52,100,55,masked and ideal and teensy and unperturbed
77,188,4,1998-11-28 02:01:04,34,19,indomitable and comprehensive and beginning and voiceless
98,104,2,2002-07-03 01:58:54,60,32,unmentionable and undignified and depraved and profane
160,157,2,2016-09-11 06:28:49,20,27,bruised and seditious and musty and rainy
51,0,3,2019-09-16 23:55:20,37,41,initial and vicious and insane and eventful
62,171,1,1981-11-23 11:41:03,69,23,individual and chic and operational and enthusiastic
84,22,4,1991-10-22 04:24:37,11,36,grim and wrenching and marketable and prickly
116,192,5,2012-03-05 23:38:16,61,27,egomaniacal and patronizing and indivisible and glamorous
141,123,4,2020-10-06 19:52:18,9,67,slanting and richest and savvy and proper
38,134,3,1980-01-25 11:56:44,68,63,initial and colossal and unregulated and fat
149,10,4,1990-08-08 09:02:24,59,15,villainous and perceptual and distracted and critical
96,119,2,1979-10-08 23:41:11,23,71,bushy and gusty and spirited and pettish
124,65,1,1971-03-05 23:55:31,18,37,renegotiable and vexed and moldy and visual
116,51,2,1990-10-02 05:39:28,28,25,perennial and indisputable and valuable and unblemished
154,99,2,2020-06-19 06:10:59,76,52,teensy and surprised and gracious and jerky
129,135,5,1998-01-13 23:06:56,15,17,overcrowded and fawning and gabby and warm
197,198,5,1982-04-08 01:14:21,56,75,motor and eloquent and photographic and much
158,33,1,1989-05-12 06:58:43,39,6,transcendent and soakingwet and lowly and pallid
16,131,3,1986-05-29 23:52:03,41,70,mundane and picturesque and relaxed and shady
129,160,3,2014-07-08 06:44:03,92,84,annoying and next and gangly and mental
131,78,2,1995-04-27 12:45:44,20,76,undeclared and embittered and classifiable and mammoth
187,191,4,1979-09-24 16:34:24,9,75,tenderhearted and unwholesome and gregarious and cynical
18,96,5,1983-05-23 19:16:42,58,9,merry and pious and majestic and harmonious
121,171,5,1999-04-28 19:14:30,83,25,poorest and earnest and cultured and vanishing
161,43,1,2003-07-03 23:57:31,65,41,silver-tongued and classified and slight and wide-eyed
40,78,4,2020-12-26 05:26:43,24,73,irreplaceable and efficient and changeable and medical
70,175,3,2003-09-21 17:25:38,92,42,inhumane and stern and underdeveloped and quantitative
182,195,1,2002-08-04 15:17:31,64,38,hasty and compassionate and putrid and novel
164,107,2,2016-12-16 12:02:05,78,85,wholesome and committed and serene and utter
119,36,1,2007-05-12 19:34:56,48,83,resounding and psychosomatic and chicken and either
121,10,2,2017-12-22 20:56:52,11,94,barbaric and unconquerable and middle-class and illusive
168,8,4,1979-12-02 07:48:31,70,41,true and smoggy and malignant and despairing
15,98,2,2006-08-03 20:18:57,50,90,savage and hot-blooded and unwary and tidy
99,115,1,2008-09-22 14:24:51,3,96,acoustic and illusive and incomparable and east
111,174,3,1990-05-16 23:42:48,17,80,understanding and witless and quick-thinking and hanging
159,83,4,1995-02-16 10:12:43,70,47,applauding and unimpeachable and gregarious and monopolistic
181,148,1,1997-12-02 14:41:23,41,53,whose and irrepressible and advanced and grim
164,13,3,2012-02-24 14:42:01,28,39,overcautious and binding and overpriced and upmost
114,68,1,2011-11-28 20:28:55,6,10,seething and environmental and ingenuous and idyllic
60,117,1,1998-08-10 12:49:03,73,2,democratic and smiling and hospitable and ruthless
78,122,2,2018-05-28 17:44:57,90,84,sequential and street and inhibited and rectifiable
118,189,2,1991-04-24 08:04:25,61,87,discriminating and private and unmotivated and meandering
112,15,2,1972-01-21 23:08:45,14,85,heartless and inside and ultimate and itchy
184,149,1,2011-08-03 20:07:55,24,95,youthful and curt and tapered and unbalanced
72,8,3,2021-04-14 21:57:59,19,3,unsociable and left and irreparable and small-time
23,182,4,2021-09-12 07:06:58,89,38,selfish and warring and balding and cagey
48,29,2,1979-10-08 23:50:24,91,73,bubbly and blistering and flavorless and nonexclusive
166,60,3,1981-02-13 20:25:21,88,27,skimpy and oversized and malicious and frugal
165,15,1,2006-05-24 23:08:31,42,25,skin-deep and jittery and ritzy and industrial
25,42,4,2017-09-12 17:53:14,85,74,impersonal and moving and unappealing and relevant
20,36,4,1977-05-02 18:07:46,37,36,shocked and burning and expedient and hectic
12,167,3,2021-03-16 22:43:12,100,49,enormous and boring and rumbling and such
130,90,2,1979-09-27 17:41:22,37,62,plane and aware and refractive and booming
175,52,4,1986-12-22 03:48:17,79,44,formative and expressive and gaunt and frail
165,109,2,1991-10-18 01:31:44,8,26,embarrassing and delectable and chilling and fireproof
195,33,4,1977-07-29 04:02:11,41,27,treasonous and near and ingenious and visceral
116,33,4,1975-10-21 07:18:55,27,21,whispering and lackadaisical and multicultural and specialized
75,24,4,1970-09-04 19:11:50,45,32,kitchen and hallowed and horrid and steaming
5,29,1,1975-10-05 01:23:42,67,4,lasting and ten and insensible and defiant
91,105,4,1977-11-22 07:33:47,12,19,cloudless and exterior and voiceless and brash
44,8,2,2020-11-25 22:02:51,74,38,blind and low-ranking and orphaned and unappetizing
29,113,3,1976-06-25 15:53:06,26,18,otherwise and triangular and misleading and deficient
99,22,2,1972-05-28 23:21:47,31,6,competent and uncritical and bedazzled and feared
137,129,4,2011-11-23 15:52:48,52,20,futuristic and thrilling and inhospitable and likable
84,193,1,2004-02-01 04:51:44,18,16,trainable and gratis and purple and unappreciative
151,75,5,2003-01-22 02:04:24,33,15,unlawful and inhospitable and worrisome and separate
180,82,1,1974-02-05 17:55:21,61,49,inferior and two and unobserved and verifiable
196,195,4,2008-05-26 01:42:25,26,83,enough and balding and well and well-qualified
172,193,2,1994-09-26 15:05:37,59,78,disliked and unopened and political and soothed
61,51,4,2010-09-20 04:42:11,71,93,arresting and alarming and confusing and seasonal
42,130,2,2011-01-09 03:48:36,38,45,pressing and victorious and chewy and coy
152,181,3,1976-11-12 21:30:56,13,67,whole and scary and inconclusive and cursed
132,98,4,2003-09-15 01:06:24,91,32,encouraging and greasy and pragmatic and hard-to-find
172,25,3,1985-11-16 01:18:48,15,85,shocking and obtuse and pernicious and replaceable
28,11,2,2006-04-05 17:10:14,83,10,cordial and superstitious and urbane and disturbed
154,167,5,1974-12-14 14:40:40,60,87,taboo and evocative and stained and big-city
186,159,3,2020-09-18 21:43:11,63,86,famous and tropical and rhythmic and parking
39,13,1,2005-01-19 10:46:07,3,58,formative and clandestine and declining and crooked
13,190,2,1972-02-08 01:48:45,58,21,apathetic and mistrustful and promising and previous
33,100,4,1986-07-07 04:18:54,5,3,snotty and theological and voluminous and unqualified
53,185,4,1984-09-14 18:43:23,38,44,homely and uninsurable and recognizable and ambulatory
0,47,3,2002-08-09 13:53:29,70,8,unreliable and somber and sunny and expiring
94,128,3,2018-04-09 02:29:35,78,75,cagey and freakish and fishy and avant-garde
194,109,1,2005-10-28 11:14:08,49,73,stacked and blooming and cornered and individual
181,162,4,1997-11-14 18:21:31,97,41,measurable and filtered and refurbished and searing
141,56,4,1997-03-20 13:31:53,13,61,rancorous and direful and pious and wide-eyed
12,176,5,2009-09-08 22:56:05,35,77,terminal and expired and popping and coincidental
18,155,1,1980-07-17 05:59:16,99,39,jealous and dispensable and mountain and blushing
133,47,2,2009-01-18 11:24:36,22,76,unscientific and prenatal and bureaucratic and half
182,71,2,1981-07-12 23:14:48,81,36,melodious and encouraging and incorruptible and top
94,166,3,2000-01-29 10:27:13,47,43,comfortable and doubtful and deliberate and instinctual
180,49,2,1974-06-08 11:23:56,1,62,mature and inhibited and unpersuasive and coldhearted
76,141,4,2005-06-04 16:17:29,46,92,approachable and paltry and tanned and steaming
96,155,3,1976-06-09 04:31:16,47,11,rotund and eruptive and intricate and repaired	.repeatable
185,98,2,1999-02-10 05:41:38,79,92,angelic and vital and true and healthy
88,14,1,2010-03-19 17:24:38,71,2,fitted and intolerant and big-headed and obese
81,183,1,2012-05-04 11:52:34,93,20,inhabitable and contradicting and same and darkened
158,10,1,1975-01-01 11:16:28,16,14,mammoth and predisposed and single and acrid
48,77,4,2014-07-29 21:40:20,58,92,warning and shimmering and winning and skinny
6,120,2,1990-10-24 16:19:33,99,50,restrictive and weak-willed and unjustifiable and smelly
96,85,3,1982-10-15 10:28:58,52,67,repetitious and maintainable and gratis and wakeful
116,137,4,1971-07-28 17:08:04,62,17,unremitting and vulnerable and challenging and ultraconservative
140,134,4,2001-06-06 14:25:42,45,13,impossible and fateful and maiden and idyllic
16,48,2,1992-03-18 04:35:27,86,55,scratchy and wacky and danceable and embarrassed
11,128,3,2010-12-13 19:02:21,10,17,nifty and ultraviolet and uncomplaining and graceful
186,142,4,2021-02-08 17:36:37,11,60,considerate and oxymoronic and fishy and dissimilar
128,92,2,1971-12-29 18:38:35,24,83,nominal and erasable and wary and cocky
4,72,1,1998-05-10 07:39:24,42,2,opulent and oversized and vagabond and avian
133,199,5,1977-03-10 05:54:23,34,84,omnivorous and single and musical and humming
100,194,4,2010-01-04 22:39:31,77,7,precipitous and mercurial and limp and concurrent
103,145,4,2014-06-09 10:58:05,32,99,classifiable and closeable and educated and peerless
79,174,4,2011-07-21 03:14:54,91,88,sparing and imperialistic and bloodthirsty and subordinate
196,87,5,1987-08-27 12:40:55,80,19,intelligent and hysterical and coldhearted and expressionistic
166,52,5,2010-03-08 23:09:44,73,61,ruptured and underdeveloped and brawny and problematic
54,174,2,1992-08-26 03:05:49,67,71,well-off and noncompetitive and limp and cranky
142,169,5,1996-08-26 20:15:27,13,96,hungry and lead and atypical and studied
35,43,3,1999-12-24 20:11:24,58,5,larcenous and pivotal and wobbly and long-term
70,7,4,1975-05-07 02:03:03,95,67,defendable and unalienable and sensational and inarticulate
122,7,3,1984-10-13 12:39:26,97,88,inexcusable and famous and adopted and disobedient
170,142,2,1992-09-29 05:47:57,81,91,ravenous and jaded and dangerous and largest
182,79,1,1992-12-20 17:23:53,45,99,vacant and lateral and heartbreaking and gratified
23,35,4,2011-09-09 17:04:03,50,53,assured and well-read and embroiled and irreparable
30,61,4,1989-12-06 22:33:05,98,1,musical and unobserved and primitive and mother
69,20,2,2005-11-26 05:45:50,13,95,peppery and barefooted and assured and midweek
145,21,5,1985-12-03 20:54:28,100,38,expressive and sublime and detectable and microscopic
161,106,1,2004-11-09 01:50:09,87,48,stern and well-rounded and whining and prompt
66,133,5,1989-06-13 01:23:08,87,39,green and selective and quick-tempered and inseparable
89,189,4,1983-06-03 12:46:44,73,38,disaffected and earthy and insane and selected
57,140,2,2004-02-23 22:35:53,10,70,expressionistic and musical and inevitable and single
104,46,5,1977-06-22 11:05:27,64,38,cognitive and rainbowcolored and preposterous and shrill
34,158,2,1980-03-02 18:40:05,70,19,bloated and jumpy and artificial and cheerful
28,98,3,1982-05-08 06:11:36,73,39,preventive and banned and despised and well-suited
171,180,3,2000-11-09 23:31:40,29,8,unscrupulous and reasonable and gratuitous	.grave and rigid
156,75,4,2011-07-14 18:03:41,36,46,menacing and consummate and searching and hypersensitive
10,102,4,2020-05-17 14:07:44,84,92,overemotional and incidental and barbaric and attainable
152,87,5,1982-11-09 18:49:19,70,79,caged and gullible and wakeful and intermittent
2,137,4,2007-09-26 22:11:09,75,90,dressy and unhealthy and royal and inflexible
94,34,3,1987-11-13 18:51:07,9,50,unresponsive and contemporary and indirect and fatigued
76,58,2,1999-09-24 17:20:41,14,47,untapped and remote and hyperirritable and indecipherable
82,18,3,2016-10-08 03:24:22,22,75,combined and flaky and inflated and gilded
101,174,4,1989-11-04 10:40:54,63,53,succinct and husky and third and peppery
104,81,2,2010-03-18 10:33:59,13,63,refractive and needless and riotous and beneficial
39,177,2,2003-04-13 23:36:35,14,66,tiring and nearby and creeping and pregnant
167,199,2,2004-07-29 17:41:45,60,18,antiseptic and pricey and reproductive and smug
63,87,3,1971-09-26 03:35:42,3,24,lumpy and treacherous and notable and programmable
162,22,4,1977-10-02 02:15:35,7,64,fearless and longest and mortified and intricate
160,93,3,2011-11-11 10:48:09,12,18,dissolving and educated and prim and impulsive
8,171,1,2010-02-06 10:16:37,78,66,up-to-date and grand and ridiculing and itchy
47,66,1,1976-01-18 11:47:16,96,11,alive and imprecise and revised and known
40,10,3,1982-05-12 08:26:40,85,91,astounded and infernal and bothered and dubious
117,70,2,2002-05-15 03:43:47,52,38,inarticulate and unverified and naughty and computer
0,23,3,1998-03-24 07:13:11,2,24,thinkable and unconventional and sizzling and unreceptive
32,176,1,2016-01-29 03:35:44,62,78,reassuring and cantankerous and treatable and grubby
150,94,4,2010-11-02 18:29:21,68,51,crashing and dwindling and swift and humdrum
7,23,3,2014-04-22 14:41:12,47,11,sweaty and mysterious and topical and briny
134,199,1,1984-11-12 15:47:14,58,65,subordinate and key and uneventful and forgetful
57,40,2,2002-03-07 10:47:38,24,88,used and quirky and republican and passionate
100,108,5,2004-02-05 11:13:50,2,98,reasonable and intimidating and enraged and vain
113,186,5,2014-12-10 03:39:30,12,23,overzealous and affectionate and autobiographic and poisonous
159,178,2,1998-12-23 13:06:32,10,99,petite and brawny and insistent and supercilious
71,95,5,1972-11-07 19:31:36,93,17,slanting and poisonous and diplomatic and close-minded
13,21,2,2005-04-04 05:28:27,96,62,wakeful and distasteful and brazen and grieving
23,63,3,1983-05-05 08:04:43,41,28,artificial and hypersensitive and wistful and dispensable
35,186,1,2002-07-24 16:11:35,42,43,mushy and dry and satisfied and sticky
68,30,4,2005-01-23 21:52:09,80,12,glib and daunting and invaluable and rural
62,182,5,1972-05-11 16:30:18,26,27,ten and talkative and legendary and celestial
49,119,3,2006-11-23 09:57:07,27,70,low-fat and tearing and bronze and emotional
95,12,1,2011-03-11 13:22:30,50,56,undiminished and wretched and ineffectual and binding
41,51,5,2014-03-04 09:30:14,75,42,unmemorable and occupational and sturdy and shrieking
154,12,3,1984-08-20 11:15:05,89,44,bohemian and humdrum and dizzy and loathsome
145,132,1,1983-04-25 01:05:48,88,65,gurgling and fun-loving and detached and soaked
112,191,2,1988-05-07 11:39:53,81,24,unadulterated and preferable and detestable and irrefutable
170,188,2,2012-06-24 11:31:58,35,36,timorous and these and amazing and crushable
139,189,4,2018-10-01 17:18:09,50,55,"meager and small-scale and resolvable and many,"
121,119,5,1985-12-15 21:40:46,57,88,crestfallen and rational and consecutive and unfair
22,46,4,1994-12-28 01:19:53,84,86,contemplative and stormy and ill-equipped and scornful
177,132,3,2004-06-15 09:52:40,95,39,crippling and unlicensed and inventive and adaptive
182,117,1,2004-06-29 01:50:12,16,33,blissful and prejudiced and reluctant and velvety
43,116,3,1994-04-19 02:38:18,44,80,sonic and well-balanced and gurgling and authoritative
178,30,4,1994-09-20 15:49:17,100,95,richest and stark and moral and changing
137,140,1,1976-12-23 18:13:27,14,50,clashing and substantiated and well-used and treatable
26,131,2,1989-06-20 01:46:53,48,85,joyful and OK and indifferent and melodic
34,94,4,1982-08-26 23:43:01,48,59,hapless and digital and defensive and alternative
85,0,5,1999-05-20 04:08:09,19,34,cursed and jubilant and intuitive and dispensable
82,127,1,1972-08-04 14:50:33,25,53,lost and boisterous and additional and commemorative
168,74,2,1988-04-10 10:25:38,24,27,biographical and nasal and untried and constitutional
181,104,2,2019-01-22 07:24:52,14,30,wry and derogatory and perky and exponential
80,110,4,1990-09-19 01:04:23,3,86,uncooked and trusting and wretched and untapped
68,156,5,1988-09-01 11:56:28,64,1,illegible and bothered and sixth and enticing
175,82,4,1983-02-02 02:40:39,53,98,aromatic and upset and fragrant and ten
114,1,5,2004-08-13 23:58:25,22,66,euphoric and uninsurable and certified and burnable
99,167,2,2019-10-04 11:55:22,49,22,attractive and utter and pumped and egocentric
33,96,3,1976-06-05 22:42:40,47,87,four and unknown and scrumptious and consecutive
53,102,5,2019-01-11 04:53:40,68,14,ringing and active and exasperating and treatable
101,84,4,2009-01-29 22:25:38,98,4,gutsy and bizarre and domineering and manageable
69,155,5,1981-03-27 04:05:05,1,48,well-liked and confidential and preparative and tall
180,53,1,2002-08-21 16:59:37,60,9,spiritual and gratuitous	.grave and quickest and uncommunicative
66,57,5,2011-05-03 14:21:42,30,58,engrossing and vocal and challenging and observant
156,76,3,2005-07-02 12:19:09,32,36,concerted and ultrasonic and beckoning and anticlimactic
108,31,4,2000-06-19 17:35:46,40,56,teeny and refreshing and beautiful and unnoticeable
135,42,1,2020-07-09 10:06:58,56,6,painful and seamless and excitable and abounding
147,39,3,2012-04-25 09:01:22,55,80,level and ineffective and presumable and steely
166,26,2,1982-10-27 07:16:02,97,11,virtuous and unaffected and its and unbounded
161,124,4,1972-05-28 03:54:22,76,64,morbid and pungent and recyclable and flickering
116,71,1,2017-05-24 20:18:57,4,1,professed and unaided and portly and swollen
3,89,3,1981-07-15 15:31:17,86,26,exasperating and historical and incomparable and sleeping
111,167,3,1991-09-06 13:12:50,95,96,abounding and nonverbal and overall and fruitless
149,98,5,1985-09-19 16:56:39,32,94,chemical and benign and high-risk and vicious
183,67,1,1974-02-01 03:20:21,76,32,disorderly and calculable and fearful and testy
16,187,1,2010-06-23 08:20:37,86,15,consummate and prim and unsuccessful and incomparable
193,53,1,2013-10-11 05:44:21,95,9,squalid and untruthful and gooey and renewable
11,14,4,1974-09-21 11:04:47,49,40,rigorous and reclusive and functional and impressive
174,7,2,1975-12-15 03:02:26,89,85,authoritative and reviled and irritated and prodigious
84,122,3,1988-01-04 03:48:35,87,3,cliquish and atomic and peevish and speedy
105,46,3,2012-09-19 21:47:30,98,38,sappy and rescued and honorable and unalterable
